Title,Price,Sales
"DISPLAY STAND for Star Wars Lego 75394 75055 75190 8039 Star Destroyer ,Venator","15,25 EUR",
Lego Minifigure Star Wars - Scout Trooper (sw0005b) Set 9489,"5,49 EUR",
Star Wars Imperio Galáctico Corbata Traje de Luchador Emblema Doble Plegable Tarjeta de Identificación Billetera SEGUNDA,"11,88 EUR",
Star Wars: Unlimited Spark of Rebellion Booster 6-Caja ¡ESTUCHE SELLADO DE FÁBRICA!!,"619,18 EUR",
Mr Potato Star Wars BB8 Hasbro Playskool Nuevo,"20,00 EUR",
Lego Minifigure Star Wars - Stormtrooper (sw0036b) Set 7659,"5,49 EUR",
Mapa de Star Wars Galaxy's Edge-Walt Disney World Hollywood Studios - raro/apertura ,"10,79 EUR",
Cad Bane Mezzo Busto Tratto Dalla Serie Book Of Boba Fett Starwars Star Wars,"56,00 EUR",
STAR WARS THE POWER OF THE FORCE - 50th ANNIVERSARY HASBRO PULSE LIMITED EDITION,"119,99 EUR",
,,
,,
STAR WARS BLACK SERIES - HAN SOLO RETURN OF THE JEDI - ENDOR VERSION Neuf / New,"54,90 EUR",
[Star Wars] Funko Pop! Jango Fett #737,"18,80 EUR",
Star wars darth vader set 2 cutter formina tagliabiscotti cake design PDZ 8cm,"8,50 EUR",
STAR WARS BLACK SERIES - CLONE COMMANDER WOLFFE (THE CLONE WARS) Neuf / New,"54,90 EUR",
Lego Minifigure Star Wars - Stormtrooper (sw0036b) Set 7659,"5,49 EUR",
Mapa de Star Wars Galaxy's Edge-Walt Disney World Hollywood Studios - raro/apertura ,"10,79 EUR",
Figurine Faucon Millénium Star Wars / Neuf en boite / Altaya,"14,99 EUR",
FIGURINE LEGO MINIFIGURE POLYBAG STAR WARS FOIL 912286 MANDALORIAN WARRIOR,"7,99 EUR",
"DARTH VADER - STAR WARS REIMAGINADO COMO BEBÉS IMÁN NEVERA 4.25"" X 4.25""","4,60 EUR",
Artoo-Detoo (R2-D2). The Vintage Collection. Star Wars Hasbro,"21,97 EUR",
"Star Wars The Black Series 6"" X-Wing Pilot Asty Hasbro Figure","14,00 EUR",
Lego Star Wars UCS Pegatina para 75192 Halcón Milenario Han Solo,"7,00 EUR",
Star Wars Black Series - Mandalorian Privateer - The Mandalorian,"35,86 EUR",
STAR WARS BLACK SERIES - SAW GERRERA DELUXE (ROGUE ONE) - Neuf / New,"69,90 EUR",
Star Wars The Black Series Cassian Andor Action Figure Collectible Toys,"41,90 EUR",
BOOTLEG Star Wars Luke Skywalker Action Figure Vintage rare!,"25,41 EUR",
STAR WARS THE POWER OF THE FORCE - 50th ANNIVERSARY HASBRO PULSE LIMITED EDITION,"119,99 EUR",
"Jazwares Star Wars Micro Galaxy Squadron #0090 AT-AT Walker Endor 10"" Vehicle","96,45 EUR",
JEDI WARRIORS - STAR WARS - SAGA - ATTACK OF THE CLONES - 2003,"64,99 EUR",
🔥 Figura 1/6 Hot Toys TMS107 Star Wars The Mandalorian Moff Gideon NUEVO,"261,02 EUR",
LEGO Star Wars: Forja Mandaloriana de Armero (75319),"45,00 EUR",
STAR WARS BIG JABBA ACTION FIGURE,"19,90 EUR",
FIGURA SOLDADO REBELDE HOTH STAR WARS EL IMPERIO CONTRAATACA SERIE NEGRA HASBRO,"33,90 EUR",
Jedi Knight Revan & HK-47. The Vintage Collection. Star Wars Hasbro,"57,21 EUR",
3 PIEZAS M3-A Interceptor Scyk Scum Fighter Star Wars X-Wing Miniaturas Figuras Juguetes,"14,51 EUR",
Kenner 1980 - Star Wars - Hoth Imperial Attack Base Bridge Bunker - Piezas de pared,"34,57 EUR",
McDonald's happy meal 2009 Star Wars Delta-7 Jedi Starfighter,"20,00 EUR",
Star Wars Action Fleet - Luke Skywalker Rancor - LFL - Hasbro 1998,"59,90 EUR",
STAR WARS BLACK SERIES - CLONE TROOPER HALLOWEEN EDITION - Neuf/New,"59,90 EUR",
Star Wars POP! Bo-Katan Kryze Funko Store Exclusive 497 - Funko Pop,"19,90 EUR",
Nuevo elenco de apoyo de racimo de parques Disney elige alfiler Rey León Aladdin Star Wars,"23,02 EUR a 33,30 EUR",
BOBA FETT - STAR WARS - THE POWER OF THE FORCE- 1995 - ¡NUEVO!,"19,99 EUR",
Pop Star Wars Chewbacca 513 2022 Galactic Convention Exclusive Figurine Disney,"19,00 EUR",
Star Wars Hasbro ARC-170 Fighter Revenge of the Sith 2005,"175,00 EUR",
"STAR WARS BLACK SERIES Q9-0 (ZERO) (6 inch, 15 cm), HASBRO, MISB","21,95 EUR",
Star Wars: The Rise of Skywalker [Blu-ray Slipcover Only],"4,33 EUR",
EBOND Star Wars Y-WING FIighter Gold Leader Hot Wheels Die-Cast MM000099,"9,41 EUR",
Star Wars / ROTJ El Retorno del Jedi Boba Fett Tamaño Completo Wookiee / Padawan Trenzas -3,"19,58 EUR",
Funko Pop! DARTH VADER WITH TIE FIGHTER#176 STAR WARS,"85,00 EUR",
"POP STAR WARS BOBA FETT , de Funko numeros 462","15,00 EUR",
LUKE SKYWALKER FROM ELECTRONIC POWER F/X - STAR WARS - POTF - 1997 - ¡NUEVO!,"17,99 EUR",
"Star Wars Mission Fleet Galactic Clash 2,5"" Figura Paquete de 4 Obi Vader Reva Ned-B","18,43 EUR a 21,89 EUR",
STAR WARS CASQUE BOBA FETT - ALTAYA (vendeur pro),"9,90 EUR",
Lego Minifigure Star Wars - ARF Trooper (sw0378) Set 9488,"12,75 EUR",
Figura Marrok Star Wars Ashoka Black Series Hasbro,"31,90 EUR",
"Q9-0 (ZERO) BLACK SERIES - 11 STAR WARS: THE MANDALORIAN 6"" HASBRO DISNEY. NEW","24,90 EUR",
Sega Prize Figurine LPM - Star Wars Astromech R4-K5 Droid,"27,14 EUR",
EMPEROR PALPATINE WITH WALKING STICK - STAR WARS - THE POWER OF THE FORCE - 1996,"21,99 EUR",
FIGURA BAZE MALBUS STAR WARS The Black Series NUEVO PRECINTADO Hasbro Rogue One,"12,95 EUR",
"Darth Vader Versión 2 Saga Leyendas Guerra de las Galaxias 30 Aniversario Sin usar, en caja Sellado D1","14,40 EUR",
STAR WARS - Finn & First Order Riot Control Stormtrooper Action Figure Hot Toys,"240,00 EUR",
Lego® Star Wars - 75015 - Corporate Alliance Tank Droid - con instrucciones de construcción (BA),"64,50 EUR",
Star Wars The Vintage Collection (2010) - VC08 - Darth Vader - Loose,"25,00 EUR",
Sand Trooper Star Wars Kit figure resina 3D! UNPAINTED,"29,99 EUR a 79,99 EUR",
LEGO Commander Fox Star Wars Minifigura TORSO Desde 7681 sw0202 Clon NUEVO Genuino,"17,83 EUR",
DESTROYER DROID - GEONOSIS BATTLE - AOTC - STAR WARS - SAGA 02/48 - 2002 ¡NUEVA!,"21,99 EUR",
STAR WARS CASQUE BOUSHH - ALTAYA (vendeur pro),"9,90 EUR",
Nightsister Merrin v2 Jedi Survivor cabeza personalizada para figura de acción de Star Wars,"6,92 EUR a 26,51 EUR",
STAR WARS A-WING Metal DIE-CAST Altaya n°12 NEUF,"37,90 EUR",
Bolso reutilizable Star Wars vintage,"40,34 EUR",
,,
,,
STAR WARS A-WING Metal DIE-CAST Altaya n°12 NEUF,"37,90 EUR",
Bolso reutilizable Star Wars vintage,"40,34 EUR",
Funko POP ! T-shirt size M Star Wars a New Hope size M - IN STOCK,"26,78 EUR",
4 personaggi star wars hasbro made in china leggi.,"39,90 EUR",
STAR WARS CASQUE BOUSHH - ALTAYA (vendeur pro),"9,90 EUR",
Nightsister Merrin v2 Jedi Survivor cabeza personalizada para figura de acción de Star Wars,"6,92 EUR a 26,51 EUR",
STAR WARS RETRO COLLECTION CHEWBACCA PROTOTYPE EDITION (YELLOW),"19,99 EUR",
Figurine articulée Star wars rogue one captain cassian andor 10 cm,"9,90 EUR",
"Star Wars: Return of the Jedi 4K (3-Disc UHD/Blu-ray,2020)+Slipcover.Disney","56,26 EUR",
Star Wars The Black Series Archive - Luke Skywalker (Pilot),"32,59 EUR",
Letrero de póster de película de metal Star Wars A New Hope 8x12 [B],"20,75 EUR",
POLYBAG FOIL FIGURINE LEGO STAR WARS 912283 LE PIRATE TUSKEN HOMME DES SABLES,"5,99 EUR",
Star Wars figura Scuba trooper Legacy TLC 2008 incompleto faltan aletas,"11,00 EUR",
Star Wars Darth Vader AT AP Mandalorian Jedi Sith Empire Vintage Kenner Custom,"229,99 EUR",
Star Wars Retro Collection Mandalorian Prototype Action Figure Casco Giallo,"17,00 EUR",
Star Wars Hasbro Black Series Archive Action Figure Ahsoka Tano 15 cm,"59,00 EUR",
STAR WARS Sous-Marin Gungan Bongol DIE-CAST Altaya n°23 NEUF,"37,90 EUR",
Star Wars 0-0-0 & BT-1 Kotobukiya ARTFX+ 1/10 COME NUOVO SCATOLA BUONE CONDIZION,"230,00 EUR",
STAR WARS Kenner Vintage - Darth Vader (Original Sword Broken Cape + Repro Cape),"27,90 EUR",
GARINDAN (LONG SNOOT) - STAR WARS - THE POWER OF THE FORCE - 1997 - ¡NUEVA!,"18,99 EUR",
Star Wars Jedi Temple Keeper minifigure,"12,00 EUR",
FIGURA REVA THIRD SISTER STAR WARS The Black Series NUEVO PRECINTADO Hasbro,"14,95 EUR",
Hasbro - R2-D2 - Star Wars Droids Vintage Collection,"23,54 EUR",
"Star Wars: El Retorno del Jedi - Lando (2023), Variante Cubierta B, Neuware, Nuevo","5,25 EUR",
Figure Bo-katan Kryze The Mandalorian Star Wars Vintage Collection Hasbro,"21,90 EUR",
LEGO Star Wars - AT-ST Pilot - Figur Minifigur Endor AT-ST Walker 75332,"9,99 EUR",
Lego Star Wars UCS Pegatina 7181 Sienar Sistemas de Flota Tie Interceptor,"7,00 EUR",
Letrero de póster de metal Star Wars Andor 8x12 [B],"20,75 EUR",
Kylo Ren / Star Wars / The black series / Hasbro 2016,"40,00 EUR",
"Juego de estatuillas Star Wars La fuerza despierta, nuevas en paquete original sin abrir. Nuevo en caja","23,05 EUR",
Star wars Imperial Scout Trooper Commander minifigure,"15,00 EUR",
"Star Wars figure Poe Dameron Black Series 3,75"" / 10 cm Walmart sealed","18,00 EUR",
Soporte de exhibición 3D + ranuras para Lego 75055 Destructor Estelar - Imperial (Star Wars),"21,44 EUR",
Star Wars The Black Series 2022 Princess Leia - NEUF LIVRAISON GRATUITE,"15,90 EUR",
"Star Wars figures Rebel Commando Pao & Imperial Death Trooper Rogue One 3,75""","18,00 EUR",
Funko Pop 304 Star Wars - Sebulba - Smuggler's Bounty Exclusive,"40,00 EUR",
"Funko Pop Star Wars ""Ahsoka"" #414","23,95 EUR",
Star Wars The Mandalorian Nº 2 Variante Cubierta C Neuware 2023 Nuevo,"5,25 EUR",
"POP STAR WARS , Luke Skywalker et Grogu, numeros 583","20,00 EUR",
"Hasbro Star Wars Mighty Muggs Kylo Ren 2017 sin usar, en caja bis","36,25 EUR",
Star Wars Slave 1 Jango Fett Hasbro 2012 Vaisseau avec notice,"30,00 EUR",
Star Wars Kylo Ren 2016,"75,00 EUR",
Figura Navette X-34 Landspeeder de Metal Star Wars Serie 1 de agostini Italia,"17,45 EUR",
Kit Modelo Droide Protocolo Bandai Star Wars C3PO Escala 1/12,"100,27 EUR",
Star Wars The Black Series - Shin Hati - Ahsoka,"33,68 EUR",
"Lote De 24 Figuras Star Wars Vintage Collection, Hasbro, 9cm (3,6 inches)","380,00 EUR",
Hot Toys TMS018 STAR WARS: THE CLONE WARS 1/6 CAPITÁN REX NUEVO!!!,"375,00 EUR",
STAR WARS THE CLONE 2010 HASBRO FIGURE NEW SEALED CW02 OBI-WAN KENOBI,"25,00 EUR",
LEGO® Star Wars U-Wing 75160 boite neuve scellée,"13,95 EUR",
Snoke Star Wars Líder Supremo VC121 2017 Vintage Colección Kener Hasbro Disney,"19,99 EUR",
Star Wars Mandalorian Cruzado Jedi Guerrero Mitosaurio Parche Moral Cráneo Bantha,"9,80 EUR",
Star Wars Hasbro Clone Shock Trooper Revenge Of The Sith Skirmish In The Senate,"9,00 EUR",
Figurine Disney The Mandalorian STAR WARS POWER FORCE articulée et parlante,"39,90 EUR",
Star Wars Imán The Child,"5,00 EUR",
Star Wars The Rise Of Skywalker First Order Driver Hasbro,"27,47 EUR",
Gentle Giant - Star Wars The Mandalorian Death Watch 1/6 Bust - Previews Exclusi,"119,79 EUR",
🔥 STAR WARS AHSOKA #8 Takashi Okazaki Variant - Presale 02/19/2025 🔥,"5,22 EUR",
PADME AMIDALA 2010 STAR WARS promo ARGENTINA huevo chocolate JACK Clone Wars,"8,00 EUR",
Xcoser 1:1 Star Wars Clon Commander Cody Casco Cosplay Máscara Resina Réplica Utilería,"161,73 EUR",
Star Wars The Mandalorian Incinerator Stormtrooper & Grogu Child Action Figure,"31,75 EUR",
,,
,,
Star Wars Episode VI Vintage Collection Speeder Bike Action Figure HASBRO,"60,13 EUR",
Star Wars - Ben Kenobi Y Sabre Laser- New 1998-Kenner-Hasbro,"74,29 EUR",
Star Wars The Force Awakens Edición Limitada - Exclusiva Asda Numerada,"17,84 EUR",
INSIGNIA DE PIN STAR WARS ECOS DE LA OSCURIDAD,"43,10 EUR",
LEGO Star Wars - Prinzessin Leia - Figur Minifigur Todesstern Death Star 75159,"19,99 EUR",
Star Wars The Black Series Episode VI Luke Skywalker Jedi Knight 40 Anniversary,"32,95 EUR",
Figura de acción Kenner Star Wars Power of the Force Snowtrooper Deluxe Green Card,"19,58 EUR",
TIE FIGHTER ADVANCED X1 Modello Nave Spaziale Star Wars De Agostini SERIE 1,"22,00 EUR",
Bobble-head Star Wars VII - The Force Awake Finn wacky wobbler 15 cm Funko,"7,49 EUR",
STAR WARS VINTAGE COLLECTION: NEVARRO CANTINA MISB (WITH DEATH TROOPER INCLUDED),"39,95 EUR",
Star Wars Black Series 6'' 15cm Flametrooper Hasbro,"29,00 EUR",
Figurine Star Wars vintage : BIB FORTUNA LFL 83 HONG KONG no Vador 🔵,"22,90 EUR",
Star Wars Droids Vintage Collection R2-D2 Hasbro In Stock,"19,90 EUR",
BOLSO DE MANO ESPACIOSO MATERIAL VAQUERO ÚNICO TEMÁTICO STAR WARS ESTILO HECHO A MANO,"35,67 EUR",
STAR WARS - THE VINTAGE COLLECTION - SDCC 2021 - EMPEROR'S THRONE ROOM Neuf/New,"79,90 EUR",
STAR WARS BLACK SERIES - REY DARK SIDE VISION (Star Wars RoS N°1) Neuf / New,"39,90 EUR",
Funko POP ! Star Wars: Valentines - Ahsoka - #493 IN STOCK,"12,24 EUR",
Star Wars Black Series 40th Anniversary - SW - Chewbacca - Neuf,"60,00 EUR",
LOTTO STAR WARS ACTION FIGURE HASSK THUG HASBRO DISNEY + 60 ROLLINZ,"15,00 EUR",
Star Wars Darth Maul minifigure,"12,00 EUR",
"Star Wars The Black Series - OBI-WAN KENOBI (Jabiim) 6"" (16 cm)","49,90 EUR",
Calcomanías de armada de Star Wars para escuadrones X-Wing,"14,97 EUR",
Star Wars Black Series - Dark Sidious - Darth Sidious - Episode III,"35,86 EUR",
LUKE SKYWALKER IN STORMTROOPER DISGUISE - STAR WARS - POTF - 1997 - ¡NUEVA!,"28,99 EUR",
Star Wars Loth Cat,"150,00 EUR",
2024 Topps Star Wars Galaxy Chrome 8 Becoming Darth Vader Anakin Skywalker,"3,99 EUR",
'DIE CUT' REPLACEMENT STICKERS for STAR WARS MLC-3 MLC3 (Mobile Laser Cannon),"4,37 EUR",
Figuras de acción vintage de Star Wars elige tu propio ROTJ Kenner 1983 Jedi años 80,"10,36 EUR a 23,04 EUR",
Almohada cuadrada Star Wars Rebel Imperial,"79,15 EUR",
STAR WARS TIE ADVANCED X1 PROTOTYPE Replica DIE-CAST Altaya n°2 NEUF,"37,90 EUR",
Mini Funko Star Wars Serie Mandalorian,"9,90 EUR",
"Star Wars Princesse Leia Organa, Jeu Star Wars Legion & Shatterpoint","7,99 EUR a 8,49 EUR",
LEGO Phoenix Minifigura Personalizada Star Wars Galactic Bounty Hunter 2.0 S1 Juego Completo,"171,48 EUR",
Star Wars Elite Disney figures. Poe Dameron. FAC-028050-16162,"12,38 EUR",
Cad Bane. The Black Series. Star Wars Hasbro,"30,06 EUR",
➠ Topps Star Wars Living Set #423 Lark & Jonk - Solo: A Star Wars Story,"5,99 EUR",
Star Wars 8 Los últimos Jedi Skywalker Rey Disfraz Disfraz Halloween Carnaval Trajes,"38,72 EUR a 44,77 EUR",
STAR WARS DARK DROIDS #1 RACHAEL STOTT SCOURGED VARIANT (02/08/2023),"7,05 EUR",
"STAR WARS VINTAGE | Prune Face | Kenner 1984 | NoCOO | 3,75 | Return Of The Jedi","6,90 EUR",
Star Wars Cosplay Clone Troopers Commander Cody Mask Helmet Deluxe Collection,"100,34 EUR",
"Star Wars The Black Series 6"" Chewbacca The Force Awakens Hasbro Figure","18,00 EUR",
STAR WARS VINTAGE FIGURE 2015 / CONSTABLE ZUVIO,"5,50 EUR",
Star Wars X-Wing 2E - Ala-B A-SF-01 - Italian Version,"9,90 EUR",
13564 action figure star wars mandalorian hasbro tomy vintage indonesia 30 cm !,"14,95 EUR",
2002#Hasbro Guerre Stellari Star Wars Attack of the Clones SPEEDER # X,"19,00 EUR",
DISPLAY STAND for Star Wars Lego 75312 Slave 1 Boba Fett’s Starship Very Nice!!,"11,28 EUR",
Bo-Katan Kryze. The Black Series Archive Collection. Star Wars Hasbro,"32,38 EUR",
Star Wars The Vintage Collection Lobot (Empire Strikes Back) Kenner,"15,00 EUR",
Figurine Star Wars Attack Of The Clones R2-D2 Hasbro 2002,"24,99 EUR",
Grand Admiral Thrawn. The Vintage Collection. Star Wars Hasbro,"22,09 EUR",
"LEGO POLYBAGS selección mixta; óptimo para Pascua, Navidad, Adviento, Nicolás","8,49 EUR a 49,99 EUR",
star wars count dooku sith lord ROTS collection,"11,00 EUR",
Funko POP! Star Wars #01 Darth Vader Metallic Hot Topic Exclusive,"72,00 EUR",
Lot Obi wan Kenobi Darth Dark Maul cw01 cw08 Star Wars TCW The clone wars Euro,"100,00 EUR",
Darth Vader Fig 15 cm Star Wars. Revenge of the Jedi. The Black Series.,"34,95 EUR",
"LEGO! Cartas Star Wars / Trading Card Collection / Serie 4, Seleccionar / 1 - 151","1,00 EUR a 1,79 EUR",
REPLACEMENT STICKERS for STAR WARS VINTAGE 1980 ESB DARTH VADER COLLECTOR'S CASE,"7,28 EUR",
Lego Star Wars Hoja de pegatinas para 75095 The Tie Fighter TIE/Ln Starfighter,"6,00 EUR",
STAR WARS - Variant - Stormtrooper Play Arts Kai Action Figure Square Enix,"163,91 EUR",
Cara Dune Carbonized Star Wars The Mandalorian Kenner,"70,00 EUR",
,,
,,
Star Wars Return of the Jedi Black Series Luke Skywalker Jedi Knight Figure,"32,70 EUR",
Star Wars Black Series Mandalorian Nite Owl Action Figure HASBRO,"32,70 EUR",
Grand Inquisitor / Star Wars : Obi-Wan Kenobi / the Black Series / Hasbro 2022,"22,00 EUR",
Figura POP Star Wars Rise of Skywalker Kylo Ren Supreme Leader,"17,95 EUR",
Star Wars Micro Galaxy Squadron Obi-Wan Kenobi Jedi Starfighter #0014 Series 1,"29,90 EUR",
Funko Pop! STAR WARS POP N° 380 Moff Gideon SPECIAL EDITION (F45),"20,00 EUR",
Star Wars: Episode IV Vintage Collection Figura Darth Vader 10 cm,"17,95 EUR",
Vehicle Podracer Star Wars 1999 Episode 1 Phantom Menace Hasbro + figure Anakin,"45,00 EUR",
SCOUT TROOPER IMPERIAL PATROL (DIRTY) - STAR WARS - POWER OF THE JEDI - 2000,"28,99 EUR",
Star Wars Retro Collection - Kenner - Boba Fett Prototype Edition (Blue Head),"26,00 EUR",
Figura POP Star Wars Obi-Wan Kenobi 2 Ned-B,"21,19 EUR",
Sticker autocollant Star Wars maitre-yoda,"5,90 EUR a 14,90 EUR",
AHSOKA CW17 2010 STAR WARS promo ARGENTINA huevo de chocolate JACK Clone Wars,"8,00 EUR",
Star Wars The Black Series LEIA ORGANA SKYWALKER Force FX Lightsaber Replic 1/1,"399,99 EUR",
Star Wars Episode I Hasbro Black Series Action Figure Anakin Skywalker 15 cm,"59,00 EUR",
Star Wars The Mandalorian COBB VANTH Action Figure 1/6 TMS084 Hot Toys Sideshow,"599,00 EUR",
Nuevo Reloj Invicta Star Wars Hombre 44mm Darth Vader Edición Limitada Cuarzo Negro SS,"109,50 EUR",
2 Figuras Star Wars Cad Bane Y Fennec Shand The Book Of Boba Fett Vintage...,"46,00 EUR",
STAR WARS - Vehicle Collection 7 #06 Secret - 1/144 Y-Wing Starfighter F-toys,"32,66 EUR",
STAR WARS Kenner Hasbro - EPISODE I Retrogaming Underwater Race to Theed Game,"24,90 EUR",
Star Wars Episode 1 Hasbro Yoda Commtech FIGURINE,"14,00 EUR",
Star Wars Army of the Republic Mace Windu General of the Republic Army,"18,50 EUR",
Figurine Star Wars Kenner Expended Universe - Princess Leia 1998,"42,99 EUR",
"VIN FIFTH BROTHER FIG 9,5 CM STAR WARS RETRO COLLECTION","9,95 EUR",
STAR WARS Death Star Escape GUERRE STELLARI Cannone laser 1997 NUOVO Kenner,"22,50 EUR",
LOT 12 FIGURINES STAR WARS EN LOOSE 199?-20?? DARK VADOR / STORMTROOPER / ..,"35,00 EUR",
STAR WARS - Luke Skywalker Helmet - 1998 - POTF - Hasbro - Loose C10,"17,90 EUR",
FIGURA DE ACCIÓN STAR WARS THE MANDALORIAN TOYBOX DISNEY STORE LUCAS PELÍCULA MANDALORE,"9,50 EUR",
STAR WARS - Collezione Privata Metallo: Action Figure Elite Series C2-B5,"19,99 EUR",
"Star Wars Mandolorian - El Niño 8"" Peluche Con Etiquetas - Mattel","16,70 EUR",
Star Wars 501st Legion Stormtrooper Ejército Logo Redondo Bordado Hierro En Parche,"5,75 EUR",
Disney Star Wars - Mandalorian Official Ingot lingotto in box,"21,99 EUR",
Figurine Kylo Ren Star Wars,"14,99 EUR",
DARTH VADER DAGOBAH - ESB - STAR WARS - POWER OF THE JEDI - 2000 - ¡NUEVO!,"16,99 EUR",
Trenzas Wookiee/Padawan Estilo Imperio Boba Fett de tamaño completo Star Wars ESB [Juego 3],"19,58 EUR",
Figurine résine Star Wars R2-D2 Iron Studios Art Scale 1/10,"110,00 EUR",
STAR WARS VINTAGE COLLECTION: BOBA FETT'S SLAVE I (UNASSEMBLED) HASBRO 2020,"139,95 EUR",
R2-D2 WITH HOLOGRAPHIC PRINCESS LEIA - STAR WARS - POTF - 1999 - ¡NUEVA!,"29,99 EUR",
STAR WARS First Order Stormtrooper Sixth Scale Action Figure Set Hot Toys MMS319,"599,00 EUR",
"Star Wars Mandalorian El Niño 6""/17cm Peluche Bebé Yoda Muñeca Grogu Personalizada","26,03 EUR",
Grand Vaisseau Manta Force 1986 Bluebirds Jouet Figurine Star Wars Véhicule...,"39,90 EUR",
Hasbro Star Wars SAGA 02-05 Kit Fisto (Jedi Master) MOSC,"13,00 EUR",
Lego Star Wars Wooof Minifigura Contrabandista Guardia de Esquife 75397 Jabba's Sail Barge,"66,85 EUR",
Figurine Disney Star Wars - Luke Skywalker Pilote Rebelle,"10,00 EUR",
6 Figuras Mandalorian Star Wars Prototype Edition Retro Hasbro,"120,00 EUR",
1/6 Female Head Sculpt Star Wars Rey Actress Celebrity Daisy Ridley For 12inch,"26,57 EUR",
Star Wars A New Hope Ponda Baba The Black Series,"24,95 EUR",
Star Wars Purge Clone Trooper Imperial,"12,00 EUR",
"Star Wars Black Series OBI-WAN KENOBI Escala 6"""" COMO NUEVO (SOLO CABEZA) VENGANZA 1/12","5,98 EUR",
STAR WARS - Vaisseaux et vehicules Altaya - N°78 NAVETTE D'URGENCE,"30,00 EUR",
Star Wars Vintage Princesse Leia Organa,"22,00 EUR",
LABYRINTHE Star Wars 26666 Jeu société Collection ENFANT Garçon Fille Jeux NEUF,"25,00 EUR",
Star Wars Micro Galaxy Squadron Phantom 2 con Kanan Jarrus y Chopper #0144,"31,07 EUR",
Star Wars The Black Series Clone Trooper (Halloween Edition),"39,95 EUR",
Commander Cody (Chrome Version) MMS734 Episode III Revenge of the Sith,"250,00 EUR",
Star Wars Kenner Vintage 1979 Faucon Millenium support radar d'origine,"24,99 EUR",
Funko STAR WARS RIVALS Serie 1 Lado Luz Han Solo Minifigura con Caja,"18,43 EUR",
BANDAI S.H. FIGUARTS STAR WARS EPISODE I THE PHANTOM MENACE QUI-GON JINN.,"120,00 EUR",
Star Wars Episode II C-3PO Figure 1/6 Die Cast Hot Toys Sideshow MMS650-D46,"499,99 EUR",
Star Wars Death Star Gunner Officer & Trooper 3 Vinyl Figure Funko Pop EXCLUSIVE,"59,99 EUR",
,,
,,
Star Wars Episode II C-3PO Figure 1/6 Die Cast Hot Toys Sideshow MMS650-D46,"499,99 EUR",
Star Wars Death Star Gunner Officer & Trooper 3 Vinyl Figure Funko Pop EXCLUSIVE,"59,99 EUR",
Kit Actualización (Piezas Impresas) para LEGO® Star Wars 75325 El N-1 Starfighter,"9,99 EUR",
STAR WARS Ski Speeder V-4X-D DIE-CAST Altaya n°29 NEUF,"37,90 EUR",
Star Wars Action Fleet - Vaisseau MTT Du Commerce Droide - LFL - Hasbro 1999,"24,90 EUR",
The Mandalorian y Grogu (Deluxe Version) Star wars HOT TOYS,"499,00 EUR",
Star Wars La serie negra - Anakin Skywalker - Star Wars: La amenaza fantasma,"33,68 EUR",
Necrones Dios Estrella Trascendente Tan C'tan ,"46,11 EUR",
1:6 Hot Toys Star Wars The Mandalorian Figura Luke Skywalker (Deluxe Version),"459,99 EUR",
"Star Wars The Black Series 6"" First Order Stormtrooper Hasbro Figure","15,00 EUR",
1 x Lego Star Wars Figura - Santa C-3PO Papá Noel sw0680,"9,99 EUR",
"Figurine 6"" Star Wars Black Series 16 First Order Flametrooper Hasbro 2015","19,99 EUR",
FIGURA DROIDE IG-11 VC206 THE MANDALORIAN STAR WARS COLECCIÓN VINTAGE HASBRO EMBALAJE ORIGINAL,"27,90 EUR",
STAR WARS Darth Maul Action Figure Diamond Select Toys Disney Store Exclusive,"59,99 EUR",
Star Wars: Ahsoka Action Figure 1/6 Chopper 18 cm PREORDER,"439,99 EUR",
Star Wars Millennium Falcon Gaming UN SOLO LIENZO ARTE DE PARED Impresión de imágenes,"15,85 EUR a 55,49 EUR",
Calendario Oficial 2016 Danilo Guerra de las Galaxias El Despertar de la Fuerza,"2,96 EUR",
Nuevo LEGO Star Wars Qui-Gon Jinn Minifigura de 2007 Republic Cruiser set 7665,"27,49 EUR",
Wrecker Bad Batch Starwars ACTION FIGURE Kit resina 3D 1:6! UNPAINTED,"39,99 EUR a 59,99 EUR",
Star Wars The Vintage Collection Star Wars: A New Hope Artoo-Detoo (R2-D2),"20,95 EUR",
Star Wars The Vintage Collection The Mandalorian Axe Woves,"21,90 EUR",
Figura de acción Star Wars The Black Series Archive Bossk 6 pulgadas REEDICIÓN EN STOCK,"32,85 EUR",
Nueva Figura Hot Toys VGM63 Star Wars Lord Starkiller Edición Normal en stock,"299,70 EUR",
Star Wars Black Series 40 Aniversario Legacy Pack Legado + Darth Vader NEW,"49,50 EUR",
Hasbro / STAR WARS 4 - 2 Retro Collection Multipack / Complete Series - 100% NEW,"420,00 EUR",
Star Wars (2015-2019) #51 Marvel Comics,"4,20 EUR",
star wars uzay CUSTOM replica of vintage bootleg turkish figure Chewbacca,"39,00 EUR",
"VIN GRAND INQUISITOR FIG 9,5 CM STAR WARS RETRO COLLECTION","15,95 EUR",
Star Wars Cassian Andor Movie Action Figure Exclusive Black Series Collector's,"41,90 EUR",
Star Wars Episode 6 Black Series Princess Leia Organa (Boushh) Action Figure,"34,84 EUR",
LEGO® instrucciones de construcción Star Wars 7962 Anakin ́s & Sebulbas Pod Instruction NUEVO 316,"5,99 EUR",
Display stand for Vintage Star Wars Kenner Snowspeeder Hasbro POTF - Horizontal,"13,10 EUR a 18,20 EUR",
Boba Fett Hot Toys Star Wars,"220,00 EUR",
STAR WARS - Mythos - Yoda Polystone Statue Sideshow,"1.002,10 EUR",
"Figurine Star Wars Hasbro Alex Jaejer Clone Trooper Target 3.75""","16,00 EUR",
STAR WARS 1979 PLAQUE DE FERMETURE FAUCON MILLENIUM,"15,00 EUR",
"Star Wars Action Figurine Force Link 3,75 - 10 cm - C3525 - Luke Skywalker Exile","10,00 EUR",
Hasbro Star Wars Unleashed Battle hoth imperial encounter,"29,00 EUR",
STAR WARS IMPERIAL SHUTTLE TYDIRIUM - Navette Impériale DIE-CAST Altaya n°6 NEUF,"37,90 EUR",
Qi' Ra (Corellia) : Star wars - Force link 2.0 Solo / 2017,"15,00 EUR",
Star Wars Army of the Republic Clone Trooper Army Hasbro 2003,"38,50 EUR",
STAR WARS - Emperor Palpatine Firing - 2005 - ROTS - Hasbro - Loose C10,"15,90 EUR",
Lego Minifigure Star Wars - Old Luke Skywalker (sw0887) Set 75200,"21,49 EUR",
Star Wars Micro Machines - Royal Guard - Mini Head - LFL - Galoob 1996,"49,90 EUR",
LO-LA59 (Lola) Animatronic Edition Star Wars Obi-Wan Kenobi,"49,90 EUR",
"STAR WARS | Yoda (Firing force-blast) | CLONE WARS 2008 | 3,75"" Hasbro | Jedi","3,90 EUR",
PREORDER EFX Star Wars Episode V 1/1 Replica Snowspeeder Crew Gift,"789,00 EUR",
"STAR WARS 3.75"" (NO 6""): DEATH TROOPER - EXCLUSIVO DE WALMART 3 3/4""","21,88 EUR",
Star Wars - THE FORCE AWAKENS - LUKE SKYWALKER Personaggio 10cm Hasbro,"10,00 EUR",
LEGO STAR WARS ### DEATH HOLOGRAMA - PALPATINE SET 8039 NUEVO - NEW ### =TOP,"4,95 EUR",
NUEVO LEGO® Star Wars Clon 75316 - Minifigura Mandaloriana Bo-Katan Kryze sw1163,"10,48 EUR",
Figura Darth Vader Infinities White Star Wars Black Series Hasbro,"33,90 EUR",
NEW & SEALED BLISTER STAR WARS REBELS MISSION SERIES MS07 WULLFFWARRO WOOKIEE,"21,99 EUR",
STAR WARS LEGIÓN INFANTERÍA PLATAFORMA APOYO UNIDAD EXPANSIÓN NUEVO,"17,93 EUR",
partisan star wars legion,"4,00 EUR",
Figura de acción Kenner Star Wars Jawa First 12 1977 de colección HK original,"34,57 EUR",
Artoo-Detoo (R2-D2). The Vintage Collection. Star Wars Hasbro,"16,37 EUR",
Star Wars kotobukiya artfx Emperor Palpatine 1/10,"199,90 EUR",
Star Wars Rebels Endor Medical Diorama Sith Jedi Empire Vintage Kenner Custom,"289,99 EUR",
Bo-Katan Kryze / Star Wars The Mandalorian - Black Series Credit Collection 2022,"35,00 EUR",
,,
,,
STAR WARS GRAN GLOBO INFLABLE AIRE HELIO STORTROOPER 177cm,"18,99 EUR",
General Hux Star Wars Force Link Action Figures 9 cm Gli utlimi Jedi Nuovo,"14,99 EUR",
