Title,Price,Sales
Funko Pop Star Wars 197 Rose originale mint,"10,00 EUR",
Lando Calrissian. The Vintage Collection. Star Wars Hasbro,"20,28 EUR",
star wars funko pop Dark Trooper,"18,81 EUR",
Auguri Preziosi TG904000 Star Wars Rogue One Zaino Estensibile Con Gadget,"39,90 EUR",
LEGO Star Wars - Chewbacca - Figur Minifig Millenium Falke Wookie Han Leia 75245,"6,99 EUR",
Figura de Ajedrez Star Wars De Agostini Comandante Cody Peón Blanco 1/24,"12,74 EUR",
Figura Hot Toys MMS508 Star Wars The Empire Strikes Back Princess Leia Bespin,"380,00 EUR",
Figurines Star Wars Han Solo et Boba Fett Force Link Hasbro,"18,99 EUR",
Star Wars The Vintage Collection Star Wars: Obi-Wan Kenobi Grand Inquisitor,"21,90 EUR",
Casco Star Wars Darth Vader Venganza Sith Episodio 3 Serie Maestra,"762,12 EUR",
LEGO Star Wars Kylo Ren Lightsaber Crossguard & Cape 23901 (sw0717 & sw0663) NEW,"7,00 EUR",
LUKE SKYWALKER - TATOOINE ENCOUNTER - ANH - STAR WARS - SAGA 03/31 - 2003 NUEVA!,"26,99 EUR",
Figura POP Star Wars Emperor Palpatine Exclusive,"24,95 EUR",
Star Wars Obi Wan Kenobi Cosplay Caballero Jedi Disfraz Uniforme Conjunto Completo HOMBRE,"145,19 EUR a 152,45 EUR",
Figura de 6 pulgadas Star Wars The Black Series - Ceremonia Luke Skywalker Yavin #100,"10,32 EUR",
STAR WARS BATTLEFRONT (PC) NUOVO SIGILLATO VERSIONE ITALIANA NEW SEALED,"7,90 EUR",
STAR WARS LOOSE POTF2 WEEQUAY COMPLET,"8,00 EUR",
Star Wars Hasbro Yarael Poof Prototype Jedi Council Saga 2003,"60,00 EUR",
Star Wars Miniatures - Disciple Of Ragnos - 20/40 - Wizards Of The Coast - With,"2,50 EUR",
Star Wars Egg Attack Statua Boba Fett Arena Suit 17 cm BEAST KINGDOM,"104,87 EUR",
Star Wars The Clone Wars Yoda Action Figure,"16,98 EUR",
Hasbro Star Wars The Black Series - ECHO The Bad Batch,"30,41 EUR",
"Star Wars The Black Series 6"" Finn The Force Awakens Hasbro Figure","10,00 EUR",
Figura Capitán Rex Micro Galaxy Squadron - Versión AT-TE,"16,08 EUR",
R5-d4 Vintage Collection Hasbro Mandalorian Star Wars,"25,00 EUR",
Stormtrooper 5 Figurines Star Wars en métal Ed limitée à 2500 ex Neuve superbe,"310,00 EUR",
X-Wing Fighter Star Wars Rogue One The Vintage Collection Vehicle with Figure An,"181,89 EUR",
funko pop star wars Mandalorian 358 the mandalorian on blurrg originale mint,"40,00 EUR",
WEEQUAY SKIFF GUARD - STAR WARS - THE POWER OF THE FORCE - 1996 - ¡NUEVA!,"24,99 EUR",
Star Wars General Madine Hong Kong 1983 ROTJ Vintage Action Figure Kenner,"15,00 EUR",
Jango Fett. The Vintage Collection. Star Wars Hasbro,"32,37 EUR",
Display stand for Vintage Kenner Star Wars B-wing Hasbro BWing -Vertical display,"16,70 EUR",
STAR WARS The Mandalorian Dark Trooper 1:10 Scale Statue Iron Studios Sideshow,"199,99 EUR",
STAR WARS - Collezione Privata Metallo: ActionFigure Elite Series CAPTAIN PHASMA,"14,99 EUR",
,,
,,
Star Wars: El Despertar de la Fuerza Logotipo Blanco Aventura de Ciencia Fición Nuevo Orden Nueva República,"21,95 EUR",
STAR WARS CALENDARIO DE ADVIENTO PERFUMES Y ACCESORIOS STAR WARS,"24,99 EUR",
Star Wars Saga Legends 2007 30 aniversario oficial imperial incluye moneda.,"20,69 EUR",
STAR WARS - Episode VII - BB-8 Premium Format Figure 1/4 Statue Sideshow,"384,90 EUR",
Display stand for Vintage Kenner Star Wars B-wing Hasbro BWing -Vertical display,"16,70 EUR",
"Star Wars The Black Series 6"" Zori Bliss Hasbro Figure","10,00 EUR",
Star Wars The Vintage Collection - VC133 - Scarif Stormtrooper - Neuf,"29,00 EUR",
BOX ROTTO DARTH VADER BOUNTY HUNTER Figura 10cm DELUXE POP FUNKO Star Wars 442,"26,30 EUR",
Star Wars Yoda 3.75 inch collection,"5,00 EUR",
Star Wars The Black Series - Clone Trooper Phase I - Attack of the Clones,"32,59 EUR",
STAR WARS - Holographic Darth Maul - 2006 - TSaC - Hasbro - Loose C10,"24,90 EUR",
OBI-WAN KENOBI COLD WEATHER GEAR - STAR WARS - POWER OF THE JEDI - 2001 ¡NUEVO!,"12,99 EUR",
"Lego Star Wars, Han Solo - Camisa Blanca (sw1371) NUEVO","4,95 EUR",
Figura Casco Royal Guard Star Wars (PO195853),"17,00 EUR",
"STAR WARS -Death Watch Mandalorian 1/6 Action Figure 12"" TMS026 Hot Toys","348,41 EUR",
STAR WARS: the MANDALORIAN – LUKE SKYWALKER 1/6 Action Figure 30 cm HOT TOYS,"419,99 EUR",
"Star Wars Darth Vader 12"" x 30"" Premium Banderín WINCRAFT - Nuevo (Lado Oscuro)","10,33 EUR",
Figura Stormtrooper Reino Bestia EAA-015 ATAQUE DE HUEVO Star Wars ABS PVC,"92,22 EUR",
Crosshair Imperial STAR WARS The Bad Batch Action Figure Hasbro Black Series,"34,90 EUR",
STAR WARS Kenner Hasbro Action Figure - POTF POTF2 - Endor Rebel Soldier,"13,50 EUR",
Figurine collection Disney STAR WARS DARK VADOR Figure PVC,"11,90 EUR",
"Figura Entrenadores Star Wars Black Series 6"" The Mandalorian Shriek-Hawk Nueva","46,67 EUR",
Lego Star Wars Figurine Battle Droid + S.T.A.P ( ref:L25 ),"3,49 EUR",
"STAR WARS Kenner Hasbro - POTJ Power of the Jedi - Bossk 12"" MISB MOC NEW","95,00 EUR",
Hasbro Star wars Spacetrooper droid factory BD58,"36,00 EUR",
STAR WARS - POE DAMERON’S X-WING - Metal Die Cast 6 inches - ALTAYA,"39,00 EUR",
Star Wars the Vintage collection Yoda,"15,00 EUR",
Star Wars Han Solo & Chewbacca Kotobukiya ARTFX+ 1/10 COME NUOVO SCATOLA OTTIMA,"180,00 EUR",
LEGO® Star Wars Set || 75254 - AT-ST Ladrones Minifiguras Cara Dune || NUEVO & EMBALAJE ORIGINAL,"48,90 EUR",
Star Wars The Mandalorian Collection figurine 2022 Kuiil 10 cm KENNER,"19,90 EUR",
"STAR WARS Episode III-10 MACE WINDU (Force Combat) + ACCESSORIES, 2005","12,95 EUR",
Star Wars Ackbar Almirante Figura Metal Serie 1 de agostini Italia,"15,24 EUR",
Vintage Star Wars Promo & Merchandising - Die Cast Pin 1997 Twenty Years,"14,90 EUR",
BIGGS DARKLIGHTER - STAR WARS - THE POWER OF THE FORCE- 1998 - ¡NUEVO!,"15,99 EUR",
Greef Karga. Retro Collection. Star Wars: The Mandalorian Hasbro,"11,29 EUR",
MODELO DE BOLSILLO STAR WARS - (GA096) PADME AMIDALA,"1,42 EUR",
"FFGD4649 Star Wars Legion - Clone Wars - ""Trupas Clon de Fase I (Revalorización)""","23,90 EUR",
LEGO Star Wars Han Solo Chaleco Negro Minifigura sw0771 75159 75295 75205 75290 NUEVO,"17,16 EUR",
"STAR WARS THE BLACK SERIES 3.75"" BOBA FETT PROTOTYPE","99,90 EUR",
Star Wars Plates n.4 Design Servizio di Piatti In Melamina UndergroundToys Rare,"79,99 EUR",
"Star Wars figure Darth Vader Bespin Black Series Orange BS #06 2013 3,75""","18,00 EUR",
STAR WARS Kenner Hasbro Action Figure - Momaw Nadon,"17,90 EUR",
LUKE SKYWALKER IN CEREMONIAL OUTFIT - STAR WARS - POTF- 1997 - ¡NUEVO!,"10,99 EUR",
Star Wars Power of the Force Han Solo Kenner 1995 Version Euro Tri Logo,"24,99 EUR",
LEGO® Cono Cono Redondo 1x1 - 4589 Antiguo Gris Claro - Ferrocarril Star Wars - 5 uds,"1,14 EUR",
Attakus Star Wars Elite Collection Estatua de Sandtrooper 17 cm,"103,44 EUR",
STAR WARS : ATTACK OF THE CLONES - Vintage Collection TVC - COUNT DOOKU - VC307,"29,90 EUR",
Star Wars The Black Series Star Wars Attack of the Clones Phase I Clone Trooper,"30,45 EUR",
EMPEROR PALPATINE WITH WALKING STICK - STAR WARS - THE POWER OF THE FORCE - 1997,"29,99 EUR",
Star Wars: X-Wing Scum and Villainy SHIPS,"21,83 EUR a 29,11 EUR",
LUKE SKYWALKER WITH BLASTER RIFLE - STAR WARS - POTF - 1998 - ¡NUEVA!,"23,99 EUR",
Star Wars R3-A2 & K-3PO Kotobukiya ARTFX+ 1/10 EDIZIONE LIMITATA ANAHEIM 2015,"270,00 EUR",
JANGO FETT - SNEAK PREVIEW - AOTC - STAR WARS - POWER OF THE JEDI - 2002,"14,99 EUR",
Tarjetas de película Topps de Star Wars Attack of the Clones caja sellada de fábrica,"88,59 EUR",
Star Wars Hasbro Bib Fortuna Return Of The Jedi The Vintage Collection N.º 224,"26,00 EUR",
Lego Star Wars UCS Sticker sheet 10174 AT-ST Imperial All Terrain Scout repuesto,"7,00 EUR",
Figura Personaje HAN SOLO 15cm De Star Wars Original HASBRO E1446/B3946,"12,93 EUR",
TUSKEN RAIDER - TATOOINE CAMP AMBUSH - AOTC - STAR WARS - SAGA 03/06 2003 NUEVA,"26,99 EUR",
Star Wars The Mandalorian Giocattolo Telecomandato Figura Grogu 23 cm Hasbro,"139,88 EUR",
Pop Figura Star Wars Retro Series C-3po Esclusiva Funko,"39,77 EUR",
,,
,,
Star Wars The Mandalorian Giocattolo Telecomandato Figura Grogu 23 cm Hasbro,"139,88 EUR",
Pop Figura Star Wars Retro Series C-3po Esclusiva Funko,"39,77 EUR",
Star Wars Episode Iv Milestones Statua 1/6 Obi-wan Kenobi 30 Cm Gentle Giant,"252,08 EUR",
Star Wars Darth Maul Baño Ducha Espuma Grosvener 1999 Totalmente Nuevo,"10,70 EUR",
Gentle Giant - Star Wars - Blue Snaggletooth buste 1/7 - Episode IV,"119,79 EUR",
Star Wars (2015-2019) #42 Marvel Comics,"4,00 EUR",
STAR WARS KENNER 40th ANNIVERSARY LOT 4 FIGURES MINT,"120,00 EUR",
Lando Calrissian . The Vintage Collection. Star Wars Hasbro,"13,43 EUR",
Hot Toys Star Wars - Ahsoka Tano &amp; Grogu - The mandalorian 1/6,"381,39 EUR",
Lego Star Wars Kylo Ren's Command Shuttle Polybag (30279) New,"5,85 EUR",
Hoja de pegatinas amarillas personalizadas para Star Wars 75281 75135 75038 9494 7661,"5,75 EUR",
Star Wars: The Book of Boba Fett Grogu Retro Collection Action Figure Hasbro,"19,00 EUR",
Lotto figure star wars commtalk + 8 personaggi,"45,00 EUR",
Star Wars: Andor Black Series Action Figura Luthen Rael 15 Cm Hasbro,"38,86 EUR",
"22 YODA STAR WARS BLACK SERIES 3,75"" NARANJA","30,00 EUR",
Statua Star Wars Episode VII Premier Collection Rey Dreamer 1/7 Statue,"189,00 EUR",
Star Wars Rogue One Sergeant Jyn Erso Disney Hasbro 10cm articulada Jedha,"21,95 EUR",
Star Wars Black Series - Lando Calrissian - 40º Aniversario ESB,"32,14 EUR",
FIGURA BEN KENOBI Tibidon Station STAR WARS Black Series NUEVO PRECINTADO,"19,95 EUR",
Star Wars porte-clés caoutchouc Chewbacca 7 cm keychain 38346C,"5,99 EUR",
Gancho moral militar What The Hell is an aluminio halcón divertido de Star Wars EE. UU.,"10,36 EUR",
PORTE MANETTE TÉLÉPHONE STAR WARS CHEWBACCA CABLE GUYS,"15,95 EUR",
Hot Toys MMS 544 Star Wars : The Rise of Skywalker – Sith Trooper,"250,00 EUR",
LEGO STAR WARS 8091 CLONE TROOPER EP.3 FIGURA BOCA PUNTEADA NUEVA SW0272,"17,83 EUR",
Pack 4 Figuras Star Wars Bad Batch Clone Captain Rex,"110,00 EUR",
"Lego Minifigure Star Wars - Luke Skywalker (sw0551) Set 75059, 75052, 75056","5,75 EUR",
KENNER - PALITOY - STAR WARS - IG 88 - BOUNTY HUNTER - COO - LFL 1980 - OCC,"35,50 EUR",
"FIGURINE POP STAR WARS NEUVE ( Modèle au choix ) FUNKO , Films , Cinéma , TV","14,98 EUR a 15,98 EUR",
STAR WARS Anakin Skywalker With Ahsoka Tano hologram Sixth Scale Figure Sideshow,"399,99 EUR",
Hasbro STAR WARS The Force awakens NEUVE FIGURINE N° 10,"16,99 EUR",
Star Wars The Black Series Star Wars: Return of the Jedi Wicket 40th Anniversary,"32,95 EUR",
Statue Star Wars The Bad Batch Hunter ARTFX 1/7 - Kotobukiya,"139,99 EUR",
Star Wars The Bounty Collection Series 2 Helmet Hiding Pose Stopping Fire Pose,"21,95 EUR",
CUSTOM STICKERS for Kenner STAR WARS VINTAGE TURRET AND PROBOT PLAYSET,"5,09 EUR",
Emperor's Royal Guard ROTJ Kenner 1983 65 back MOC,"250,00 EUR",
Imperial Stormtrooper Premium Electronic Helmet. The Black Series. Star Wars Has,"171,60 EUR",
CAPTAIN TYPHO - PADMÉ'S HEAD OF SECURITY - AOTC - STAR WARS - SAGA 02/09 - 2002,"12,99 EUR",
KENNER - PALITOY - STAR WARS - IMPERIAL GUARD - EMPIRE - LFL 1983 - OCC,"22,50 EUR",
Star Wars Vintage Collection VC261 Cassian Andor Action Figure,"17,00 EUR",
Sudadera con Capucha Temática Star Wars Para Hombres Cremallera Cálida Chaqueta Gruesa Abrigo Polar,"53,23 EUR",
DARTH VADER - STAR WARS - THE POWER OF THE FORCE - 1997 - ¡NUEVA!,"21,99 EUR",
"9x pistola bláster sable de luz para accesorio de 3,75"""" Star Wars Clone Wars Trooper","6,04 EUR",
GREEDO WITH BLASTER - STAR WARS - THE POWER OF THE FORCE- 1999 - ¡NUEVO!,"19,99 EUR",
STAR WARS THE CONE WARS IMPERIAL V-WING STARFIGHTER PACKAGE CONVERTS TO DIORAMA!,"200,00 EUR",
Tarjetas coleccionables individuales de vehículos de Star Wars 1997,"2,07 EUR a 28,77 EUR",
Funko Pop - Star Wars - Mistery Minis Bobble Head. Personaggio Zorii Bliss.,"13,00 EUR",
STAR WARS - BLACK SERIES - Retro Card - Figurine Death Squad Commander - HASBRO,"29,00 EUR",
Funko Pop Nº 185- Young Jyn Erso (Star Wars),"11,95 EUR",
STAR WARS Kenner Hasbro - THE VINTAGE COLLECTION Han Solo (Endor) ROTJ,"16,95 EUR",
Star Wars The Black Series - Grand Amiral Thrawn - Ahsoka,"34,77 EUR",
KENNER - PALITOY - STAR WARS - SCOOTER TROOPER ENDOR - COO - LFL 1983 - OCC,"12,50 EUR",
Micromachines Star Wars Nien Nunb Micro Machines Playset Vintage Galoob 1996,"9,90 EUR",
Star Wars Black Series Sable Láser Force FX Elite 1/1 Mandaloriano Darksaber,"391,47 EUR",
"Star Wars Anakin Skywalker, Jeu Star Wars Legion & Shatterpoint","7,99 EUR a 8,49 EUR",
Star Wars Revell Star Destroyer Lighting Kit Rogue One,"20,00 EUR",
"THE ARMORER FIGURA 9,5 CM STAR WARS VINTAGE CARBONIZED COLLECTION","20,95 EUR",
STAR WARS CASQUE TANK TROOPER - ALTAYA (vendeur pro),"9,90 EUR",
4K Ultra HD + Blu Ray Star Wars The Rise of Skywalker New Sealed 3 Disc,"7,92 EUR",
Lot 2 PVC Figures Star Wars C3PO R2D2 Comics Spain 1986 handpainted genuine,"95,96 EUR",
Star Wars The Mandalorian Dark Trooper action figure Hot Toys Sideshow TMS032,"364,48 EUR",
,,
,,
"STAR WARS: EPISODE VII – CAPTAIN PHASMA 1/6 Action Figure 12"" HOT TOYS","346,49 EUR",
LEGO Star Wars Minifigure - Battle Droid Dark Orange (read description),"12,06 EUR",
STAR WARS VINTAGE COLLECTION VC186 BOBA FETT (RETURN OF THE JEDI) Neuf/New,"39,90 EUR",
STAR WARS ANAKIN SKYWALKER action Figure ATTACCO DEI CLONI,"20,00 EUR",
STAR WARS CASQUE TANK TROOPER - ALTAYA (vendeur pro),"9,90 EUR",
4K Ultra HD + Blu Ray Star Wars The Rise of Skywalker New Sealed 3 Disc,"7,92 EUR",
Hot Toys MMS 446 Star Wars : The Last Jedi – Rey (Jedi Training),"300,00 EUR",
"Star Wars Micro Galaxy #0131 Escuadrón Fantasma 15"" Vehículo Luces, Sonidos y 4 Figuras","44,90 EUR",
"STAR WARS The Clone Wars AMBUSH AT ABREGADO PLO KOON Loose 3.75"" Figure","9,90 EUR",
Fifth Brother (Inquisitor). The Black Series. Star Wars: Obi-Wan Kenobi. Hasbro,"16,19 EUR",
Legal Authority (V.1) - FOIL - Shadows of the Galaxy - Star Wars Unlimited,"1,44 EUR",
Star Wars Plo Koon POTJ 2000 Hasbro,"15,00 EUR",
Star Wars Episode IX Black Series Figura Zorii Bliss 15 cm,"17,95 EUR",
"Póster de la película Star Wars [con licencia-NUEVO-EE. UU.] 27x40"" tamaño teatro Struzan","28,81 EUR",
Funko POP ! Vinyl #462 Boba Fett The Mandalorian - Star Wars - NEW IN STOCK!,"12,24 EUR",
STAR WARS FIRST ORDER STORMTROOPER HOT TOYS MMS 317 SCALA 1/6 scatola con danno,"399,99 EUR",
Star Wars The Mandalorianos Monedas Bebé Yoda Coleccionable Oro - el Niño Grogu,"15,91 EUR",
LEGO Star Wars - Turk Falso - Figur Minifig Weequay Pirat Hondo Clone Wars 7753,"11,99 EUR",
"""Figura de 6"""" Star Wars The Black Series 2019 Wave 20 Vicealmirante Holdo #80 en stock""","10,32 EUR",
LEGO Star Wars - Luke Skywalker - Figur Minifigur Obi Wan Hütte Tusken 75270,"8,99 EUR",
Boba Fett (Tatooine). The Vintage Collection. Star Wars Hasbro,"24,48 EUR",
Funko POP! PEZ: Star Wars - Snaggletooth (Styles May Vary) (Importación USA),"5,46 EUR",
Funko Pop! Darth Vader Concept Series #389 Limited Edition,"55,00 EUR",
VIN THE MYTHROL FIGURA 10 CM STAR WARS THE MANDALORIAN VINTAGE COLLECTION,"18,95 EUR",
DARTH VADER / DARK VADOR - STAR WARS - THE POWER OF THE FORCE - 1998 - ¡NUEVA!,"21,99 EUR",
"R2-D2, Ignoring Protocol - Spark of Rebellion - Star Wars Unlimited","1,00 EUR",
"Star Wars figure F.O. Flametrooper The Force Awakens TFA Black Series 6"" sealed","24,00 EUR",
STAR WARS Kenner Hasbro Action Figure - Obi-Wan Kenobi Clone Wars Cartoon Net,"17,90 EUR",
RARE statuette Star Wars Attakus Training Yoda N° 0411/3000,"180,00 EUR",
STAR WARS Episode VII Droid BB-8 Premium Format Figure 1/4 Statue Sideshow,"499,99 EUR",
"Star Wars Estatua, Sw 140 , Color Surtido 2 Estatuas 17,8 CM 1/10 Artfx+ Nuevo","206,66 EUR",
2022 Star Wars Chrome Black Darth Vader - Auto Hayden Christensen PSA 10/10,"5.000,00 EUR",
PORTE CLEF STAR WARS STORMTROOPERS LUMINEUX NEUF PORTE CLé LED LAMPE,"5,99 EUR",
Guerre Stellari Star Wars Ben (Obi-Wan) Kenobi 1996 Lucasfilm New In Box# R,"19,00 EUR",
Yoda Orange Snake 100% Complete Star Wars ESB 1980 Vintage Kenner MINT GO AFA,"109,00 EUR",
BATTLE DROID (SHOT) WITH COMMTECH CHIP - STAR WARS - EPISODE I - 1999 - ¡NUEVO!,"15,99 EUR",
"Ultra Rare Sideshow STAR WARS COMMANDER CODY EXCLUSIVE 12"" 21741 NEW SEALED","449,00 EUR",
STAR WARS Kenner Hasbro - SAGA 2006 Bonus Hologram Micro Figure - LUKE SKYWALKER,"5,95 EUR",
Star Wars Black Series Archive Action Figura Luke Skywalker (imperial Light Crui,"39,77 EUR",
STAR WARS The Mandalorian 1/6 Action Figur KOSKA REEVES Hot Toys Sideshow TMS069,"349,99 EUR",
LEIA ORGANA BESPIN ESCAPE - ESB - STAR WARS - POWER OF THE JEDI - 2001 - ¡NUEVO!,"17,99 EUR",
🔥 LEGO 40676 Brickheadz Star Wars The Phantom Menace - Brand New Sealed,"56,26 EUR",
figuras de acción Star Wars Schock Trooper,"28,57 EUR",
Star Wars Darth Vader Star Destroyer Recon Shuttle Jedi Empire Vintage Custom,"159,99 EUR",
LOOSE STAR WARS MINT CONDITION SAGA 2002 REBEL TROOPER TANTIVE IV DEFENDER,"11,99 EUR",
CLONE COMMANDER WOLFFE Star Wars - promo huevo de chocolate CHIMOS - Lucas Film,"9,00 EUR",
Hot Toys TMS016 - Star Wars - The Mandalorian - Scout Trooper 1:6 action figure,"320,00 EUR",
Star Wars Vc02 Princess Leia Organa Hoth Vintage Collection,"49,00 EUR",
Star Wars Dark trooper minifigure Deluxe Version,"15,00 EUR",
Hot Toys MMS 337 Star Wars: TFA – Rey e BB-8,"320,00 EUR",
"3 cajas imperiales SW personalizadas para figura DIORAMA de 3,75 pulgadas escala 1:18","6,85 EUR",
MON MOTHMA WITH BATON - STAR WARS - THE POWER OF THE FORCE- 1998 - ¡NUEVO!,"12,99 EUR",
Ombres de la galaxie-FOILS à l'unité-Star Wars Unlimited FR,"1,10 EUR a 7,50 EUR",
Hasbro Star Wars The Black Series - Nite Owl - The Mandalorian,"32,59 EUR",
Gentle giant Star wars animated Wicket W.warrick LE850 complète [cletius],"190,00 EUR",
Star Wars the legacy collection millenium falcon Rigjt Feet Landing 2008,"25,00 EUR",
Star Wars - INT4 - Interceptor Empire Strikes Back ESB - Kenner - 1981,"12,00 EUR",
LEGO Star Wars 10x Blaster kurz schwarz - Waffe Pistole Weapon Gun 92738 4609050,"4,99 EUR",
Figurine Pop Star Wars : Saint-Valentin #499 Fennec Shand/STAR WARS/NEUVE,"9,90 EUR",
"¡VENTA EXPLOSIVA!! Hasbro STAR WARS """"The Black Series"""" logotipo JUEGO COMPLETO de 4 parches","11,53 EUR",
,,
,,
"¡VENTA EXPLOSIVA!! Hasbro STAR WARS """"The Black Series"""" logotipo JUEGO COMPLETO de 4 parches","11,53 EUR",
"STAR WARS - Clone Wars - Anakin Skywalker 1/6 Action Figure 12"" TMS019 Hot Toys","419,40 EUR",
Star Wars Vintage Collection VC222 Ahsoka Tano Corvus Action Figure,"27,50 EUR",
The Child: The Mandalorian: Star Wars Icon Light,"15,46 EUR",
Star Wars - INT4 - Interceptor Empire Strikes Back ESB - Kenner - 1981,"12,00 EUR",
LEGO Star Wars 10x Blaster kurz schwarz - Waffe Pistole Weapon Gun 92738 4609050,"4,99 EUR",
star wars venganza de los sith c-3po,"9,52 EUR",
JAR JAR BINKS TATOOINE - STAR WARS - POWER OF THE JEDI - 2000 - ¡NUEVA!,"26,99 EUR",
STAR WARS POTF2 - Luke Skywalker X-Wing VARIANT Short Saber Long Tray Variant,"60,00 EUR",
LUKE SKYWALKER FROM GUNNER STATION OF MILLENNIUM FALCON - STAR WARS - POTF 1998,"12,99 EUR",
CHEWBACCA - STAR WARS - THE POWER OF THE FORCE - 1995 - ¡NUEVA!,"23,99 EUR",
Figura Paploo Black Series Star Wars 40th,"37,50 EUR",
Star Wars Holiday R2 D2 12cm Bobble Head FUNKO Texto Original En,"29,86 EUR",
STAR WARS Episode VII Droid BB-8 Premium Format Figure 1/4 Statue Sideshow,"499,99 EUR",
Revista de Star Wars,"69,16 EUR",
Paquete de peluche premium de Star Wars The Mandalorian The Child,"69,16 EUR",
Star Wars Play Pack Grab & Go 2015 NUEVO DE LOTE ANTIGUO,"20,74 EUR",
PRINCE XIZOR - STAR WARS - SHADOWS OF THE EMPIRE - 1996 - ¡NUEVO!,"13,99 EUR",
"Wedge Antilles, Red Squadron Leader - FOIL - Reflections II - Star Wars CCG","6,00 EUR",
Kit Support/Stand (Modèle 1) pour LEGO Star Wars Slave 1 ¤ 75243 ¤MOC C7300 NEUF,"19,99 EUR",
LUMINARA UNDULI - JEDI MASTER - AOTC - STAR WARS - SAGA 02/26 - 2002 - ¡NUEVA!,"26,99 EUR",
Sabre laser star wars Hasbro Lucasfilm 2015,"20,00 EUR",
Star Wars Funko pop EMPEROR PALPATINE on Throne 614 Edition Spéciale,"36,00 EUR",
Star Wars First Order Stormtrooper Kotobukiya ARTFX+ 1/10,"75,00 EUR",
CLONE GENERIC SEASON Star Wars - promo huevo de chocolate CHIMOS - Lucas Film,"9,00 EUR",
ENDOR REBEL SOLDIER - STAR WARS - THE POWER OF THE FORCE- 1998 - ¡NUEVO!,"12,99 EUR",
Star Wars Hasbro Rey Island Journey The Last Jedi The Vintage Collection N.º 122,"12,00 EUR",
Star Wars Vintage Collection Bo-Katan Kryze Mandalorian Hasbro In Stock,"14,90 EUR",
Figurine Star Wars Plo Koon hero mashers Disney collection,"9,90 EUR",
Star Wars Force Awakens Han Solo Action Figure 9cm Hasbro,"10,00 EUR",
Star Wars 6'' 15cm The Mandalorian Hasbro,"12,00 EUR",
Phase I Clone Trooper. The Black Series. Star Wars: Attack of the Clones. Hasbro,"27,96 EUR",
STAR WARS Kenner Hasbro Action Figure - POTF POTF2 - Admiral Ackbar (Mexico),"24,90 EUR",
Star Wars Funko pop IMPERIAL ROCKET TROOPER 552 Gaming Greats Limited,"29,00 EUR",
"Star Wars 6"" Black Series R5-D4 Exclusivo 40 Aniversario.","50,00 EUR",
Star Wars Mystery Box Funko 5 Pop,"46,00 EUR",
MACE WINDU WITH BLAST-APART BATTLE DROID (WHITE) - STAR WARS - AOTC - 2002,"34,99 EUR",
Disney Infinity Star Wars : Le Réveil de la Force. Lot de 3 figurines.,"25,00 EUR",
Jouet Masque / Mask star wars the mandalorian électronique hasbro new Disney +,"46,99 EUR",
Stormtrooper / Star wars : l'empire contre-attaque 40 ans/ black series Graphite,"40,00 EUR",
Lego Star Wars Minifigura Marrón Rojizo Tocado Cabello Barrido Espalda Borrada Anakin,"2,06 EUR",
KI-ADI-MUNDI STAR WARS ATTACK OF THE CLONES THE BLACK SERIES,"28,00 EUR",
R2D2 2010 STAR WARS promo ARGENTINA huevo de chocolate JACK Clone Wars,"8,00 EUR",
STAR WARS Kenner Hasbro Action Figure - SAGA - 501st Stormtrooper Vader's Fist,"56,90 EUR",
MACE WINDU WITH BLAST-APART BATTLE DROID (RED) - STAR WARS - AOTC - 2002,"34,99 EUR",
"Star Wars The Black Series 6"" Jannah Hasbro Figure","15,00 EUR",
QUI-GON JINN - JEDI MASTER - TPM - STAR WARS - SAGA 02/32 - 2002 - ¡NUEVA!,"26,99 EUR",
DENGAR WITH BLASTER RIFLE - STAR WARS - THE POWER OF THE FORCE- 1997 - ¡NUEVO!,"12,99 EUR",
LEGO Star Wars - Han Solo (75174) - Figur Minifig Sarlacc Desert Skiff 75174,"11,99 EUR",
Axe Woves. The Vintage Collection . Star Wars Hasbro,"22,37 EUR",
Star Wars Tantive IV diorama,"237,00 EUR",
"Star Wars Action Figurine 3,75 - 10 cm - B6584 - Admiral Ackbar - Neuf","12,00 EUR",
"Figurine Star Wars The Force Awakens Chewbacca 12"" Hasbro 2015 neuve","29,90 EUR",
"1983 Star Wars ROTJ El Retorno del Jedi Darth Vader 79 espalda sin perforar sin usar, en caja","333,43 EUR",
Kenner Star Wars Vintage Trilogy Collection Lando Calrissian,"19,00 EUR",
STAR WARS Kenner Hasbro - THE VINTAGE COLLECTION The Mandalorian Koska Reeves,"19,95 EUR",
PRINCE XIZOR (DE VADER VS XIZOR) - STAR WARS - SHADOWS OF THE EMPIRE - 1996,"19,99 EUR",
Gentle Giant - Star Wars - Bo-Katan Premier Collection 1/7 - The Clone Wars,"163,39 EUR",
STAR WARS EPISODE VII FIRST ORDER STORMTROOPER HEAVY GUNNER 1/6 Action Figure 30,"346,49 EUR",
Película de Danilo Lucas 2019 calendario oficial de Star Wars (nueva y sellada),"9,50 EUR",
,,
,,
Lego STAR WARS 75373 Pack de Combat de l’Embuscade sur Mandalore,"23,99 EUR",
Star Wars Clone Wars Rex Prem Collection 1/7 Statue DIAMOND SELECT TOYS,"193,00 EUR",
Juego de montaña rusa grabado en pizarra de 6 Star Wars,"29,73 EUR",
"Star Wars Gaming Funko lote de 3 Merrin, Proxy GITD, y Bastila Shan Gamestop Exc.","69,15 EUR",
Star Wars The Last Jedi Rey (Jedi Training),"3,99 EUR",
Hasbro Disney Star Wars Captain Poe Dameron C2098/C1429,"10,00 EUR",
Star Wars The Black Series Star Wars: The Acolyte Jedi Knight Yord Fandar,"29,45 EUR",
Lego Minifigure Star Wars - AT-DP Pilot (sw0624) Set 75083,"8,49 EUR",
STAR WARS 25 figurines + vaisseau le FAUCON MILLENIUM characters chewbacca jedi,"24,90 EUR",
"Funko Pop Star Wars ""Professor Huyang"" #652","17,95 EUR",
Boba Fett (Vintage Comic Art). The Vintage Collection. Star Wars Hasbro,"23,27 EUR",
"Kit Star Wars ""Encounter with Yoda on Degobah "" ATM Models","29,99 EUR",
REPLACEMENT STICKERS for Kenner STAR WARS VINTAGE TIE INTERCEPTOR + COCKPIT,"9,10 EUR",
Star Wars Action Figura 2022 Ahsoka Tano 15 Cm Hasbro Prodotto Rovinato,"34,39 EUR",
2023 Shell Star Wars Racers Collection Darth Vader Racer + control remoto Bluetooth,"185,77 EUR",
Sergeant Jyn Erso (Eadu)_ Star Wars Rogue One_ Action Figure_ New_ Disney Hasbro,"10,96 EUR",
B2EMO #566 Funko Pop! - Star Wars - Andor - 2022 Fall Convention,"20,00 EUR",
"Star Wars Collector Series 1996 12"" TUSKEN RAIDER (BLASTER/BINOCULAR) Figure CIB","39,99 EUR",
KENNER - PALITOY - STAR WARS - REBEL LUKE SKYWALKER BESPIN -COO - LFL 1980 - OCC,"32,50 EUR",
STAR WARS - HAN SOLO ( THE BLACK SERIES),"17,00 EUR",
"Star Wars 6"" 50th Black Series Archive Case Protectors (10 uds). Evoretro","18,07 EUR",
Star Wars Retro Collection Kuiil The Mandalorian Hasbro,"9,90 EUR",
HASBRO STAR WARS THE BLACK SERIES AHSOKA TANO PERIDEA ACTION FIGURE.,"39,90 EUR",
Star Wars Legión Juno Miniatura Impreso en 3D Resina Proxy Mini,"7,60 EUR a 47,80 EUR",
DARTH VADER WITH LIGHTSABER - STAR WARS - THE POWER OF THE FORCE - 1998 ¡NUEVA!,"25,99 EUR",
Star Wars Hasbro Figurine Luke Skywalker - Black Series NEUF LIVRAISON GRATUITE,"24,90 EUR",
LEGO Star Wars - Luke Skywalker - Figur Minifigur Yavin 4 Rebellen Basis 75365,"18,99 EUR",
STAR WARS - Revenge of the Sith ROTS - Figurine Mace Windu - HASBRO,"30,00 EUR",
Star Wars Retro Collection The Armorer Action Figure,"18,70 EUR",
Camiseta Star Wars ESB Película con Licencia Retro Clásica Camiseta Empire Contraataca Negra,"20,16 EUR a 21,77 EUR",
hasbro star wars Clone Wars CW18 Anakin Skywalker,"18,00 EUR",
Wim (At Attin). The Black Series. Star Wars: Skeleton Crew Hasbro,"31,19 EUR",
Figura coleccionable mundial BANPRESTO STAR WARS C-3PO vol.3 WCF NUEVO Japón,"30,03 EUR",
OBI-WAN KENOBI Figura Personaggio in METALLO Star Wars SERIE 1 DE AGOSTINI Italy,"15,10 EUR",
De colección Star Wars Kenner Rebel Transporte Cañones Montaje y Base Repro Parte 1982,"23,04 EUR",
