Title,Price,Sales
"Varios. Prendedores Disney: Marvel, Star Wars, parques","5,76 EUR a 11,53 EUR",
"STAR WARS poupée 12 "" HASBRO Masterpiece - AURRA SING Dawn of the Bounty Hunters","59,00 EUR",
FIGURA DE ACCIÓN STAR WARS GENTIL GIGANTE LUKE SKYWALKER STORMTROOPER OUTFIT POTF,"172,85 EUR",
hasbro star wars Disney MS17 Rebels Tie Pilot And Stormtrooper,"18,00 EUR",
Figure Axe Woves Star Wars The Mandalorian Vintage Collection Hasbro,"21,00 EUR",
star wars,"11,99 EUR",
Hottoys Cosbi Star Wars Holograma Translúcido Episodio 5 Figura Juguete,"21,89 EUR a 183,27 EUR",
Calcomanías de Star Wars Armada para paquete de expansión IMPERIAL SQUADRONS II,"14,97 EUR",
Funko Pop! Marvel Dragon Ball Star Wars DC Comics WWE Terminator Muhammad Ali,"175,00 EUR",
AUTHENTIC Star Wars Captain Rex 274 Funko Pop,"166,00 EUR",
RARE BUSTE STAR WARS ALTAYA. JAWA,"65,00 EUR",
Star Wars : Assault sur l'Empire - Ally Pack Lando Calrissian Neuf | 84354076117,"10,90 EUR",
"Star Wars The Black Series 6"" Director Orson Krennic Hasbro Figure","10,00 EUR",
LEGO Star Wars III: The Clone Wars • Nintendo DS • NUEVO • NUEVO • SELLADO,"8,99 EUR",
ELIGE 2010 Legacy AT-AT Parts Cañón Endor Star Wars Escalera Puerta Derecha Izquierda,"5,19 EUR a 155,62 EUR",
"Créditos imperiales de Star Wars - replicantes para juegos, cosplay y exhibición","9,21 EUR a 74,91 EUR",
STAR WARS CCG BB PREMIERE CONJUNTO COMPLETO COMÚN POCO COMÚN 216 TARJETAS DESCIFRADOR CASI NUEVO,"34,57 EUR",
"Yoda & Kybuck 32 2007 Star Wars 30 aniversario sin usar, en caja nuevo D1","18,41 EUR",
STAR WARS BLACK SERIES - CLONE COMMANDER CODY (THE CLONE WARS) - Neuf / New,"49,90 EUR",
"Letrero de cerveza Star Wars Lando Calrissian Colt 45 con póster de la princesa Leia 19""x13""","25,36 EUR",
Topps Star Wars Digital Card Trader Green Movie-Vision Signature Rey Insert,"4,02 EUR",
Topps Star Wars Galaxy Series 5 2010 - casi nuevo - tú eliges (compra 3 y obtén 1 gratis),"2,31 EUR a 17,29 EUR",
Hasbro - Chopper (C1-10P) - Ahsoka Star Wars Vintage Collection,"23,87 EUR",
DARTH SIDIOUS HOLOGRAPH. STAR WARS HASBRO 1999,"35,00 EUR",
Star Wars - 1982 Kenner Rebel Transport,"100,00 EUR",
"Star Wars figure Han Solo carbonite Black Series blue BS#19 2014 3,75"" sealed","34,00 EUR",
"MIGS MAYFELD (MORAK) ""EL MANDALORIANO"" STAR WARS EL NEGRO SERIE 6"" HASBRO","5,73 EUR",
"Colección 5 Micro Galaxy Squadron Star Wars Mando Grogu , Droide etc series 2","69,00 EUR",
Star Wars Minifigures Lot Jedi Fallen Order Cal Kestis Second Sister Inquisitor,"37,99 EUR",
PVC Figure Ewoks Star Wars 1986 Comics Spain,"44,99 EUR",
HASBRO STAR WARS EPISODE VI BLACK SERIES 40TH ANNIVERSARY CHEWBACCA,"37,50 EUR",
FIGURA ANAKYN SKYWALKER STAR WARS La Amenaza Fantasma NUEVO Hasbro Kenner,"9,95 EUR",
"Juguete Lobot de la Colección Star Wars The Vintage, Escala de 3,75 pulgadas The Empire Strikes B","13,82 EUR",
Star Wars Attack of the Clones Mace Windu Geonosien rescue 2002,"15,50 EUR",
Peluche Hallmark Itty Bittys Disney Star Wars Greedo 2017 Popminded exclusivo nuevo en caja,"14,41 EUR",
"2.5"" Playskool Star Wars Galactic Heroes Jedi Force Trooper Vader Yoda Figure","6,42 EUR",
Star Wars Vintage Collection Mandalorian Super Commando,"16,90 EUR",
**NUEVO** 100% LEGO Star Wars George Lucas Director Minifigura,"34,57 EUR",
PRE-ORDER Star Wars The Clone Wars Action Figure Anakin Skywalker,"79,00 EUR",
Star Wars Episode VIII POP! Vinyl Bobble-Head Figure Porg 9 cm,"13,99 EUR",
,,
,,
Locandina Originale Film STAR WARS EPISODIO 3 LA VENDETTA DEI SITH (2005),"7,90 EUR",
Star Wars Return Of The Jedi Endor Rebel Soldier,"20,00 EUR",
Action Figure Figurine Darth Vader 10cm Star Wars Kenner 1996 Vintage Rare Rara,"69,90 EUR",
Sarco Plank : Star wars The force awakens / Hasbro / 2015,"11,00 EUR",
Peluche Hallmark Itty Bittys Disney Star Wars Greedo 2017 Popminded exclusivo nuevo en caja,"14,41 EUR",
"2.5"" Playskool Star Wars Galactic Heroes Jedi Force Trooper Vader Yoda Figure","6,42 EUR",
Star Wars Vintage Collection Mandalorian Super Commando,"16,90 EUR",
**NUEVO** 100% LEGO Star Wars George Lucas Director Minifigura,"34,57 EUR",
Figura Cobb Vanth The Mandalorian Star Wars Black Series Hasbro,"44,00 EUR",
Star Wars Droids Vlix vintage carded figure,"200,00 EUR",
Star Wars Black Series Ahsoka Tano The Clone Wars,"49,90 EUR",
Topps Women of Star Wars 2020 Hobby Box tarjetas explosivas,"211,44 EUR",
Jedi Knight Yord Fandar Fig. 15 Cm Star Wars The Acolyte The Black Series,"26,95 EUR",
Star Wars Action Figure 1/6 Darth Vader (Battle Damaged) 35 cm PREORDER,"599,99 EUR",
Star Wars Black Serie Supreme Leader Snoke (Throne Room) - Complete - Hasbro,"49,00 EUR",
"Action Figure Star Wars The Black Series ""Darth Vader”","30,00 EUR",
STAR WARS - Episode VII - R2-D2 & C-3PO & BB-8 ArtFX+ 1/10 Pvc Figure Kotobukiya,"137,56 EUR",
Star Wars Stormtrooper Minix Figura 12cm Minix,"27,79 EUR",
Lego Minifigure Star Wars - Chirrut Imwe (sw0789) Set 75152,"13,99 EUR",
Star Wars The Power of the Force R5-D4 Kenner 1996,"19,50 EUR",
2024 Topps Cromo Star Wars Galaxy COMPLETA TU SET Insertar Refractor (TÚ ELIGES),"7,19 EUR a 14,40 EUR",
Lego Minifigures Star Wars,"7,00 EUR a 25,00 EUR",
NEW & SEALED - STAR WARS MISSION SERIES MS10 SENATE DUEL DARTH SIDIOUD AND YODA,"16,99 EUR",
Star Wars The Vintage Collection Tantive IV Hallway with Rogue One Rebel Fleet T,"59,95 EUR",
STAR WARS EPISODE I BATTLE DROID CHIP ACTION FIGURE NUEVA EN BLISTER,"19,99 EUR",
"Droide Star Wars Astromech R2-D2 para figura de acción 6"" 7"" 1:12 K1548_M","11,52 EUR",
"Lego Star Wars 75382 UCS TIE Interceptor, wall mount montaggio a muro staffa","25,00 EUR",
LUKE SKYWALKER (SABLE LARGO) - STAR WARS - THE POWER OF THE FORCE- 1995 ¡NUEVO!,"11,99 EUR",
Funko POP ! Vinyl #678 Grand Admiral Thrawn - Star Wars - NEW IN STOCK!,"26,78 EUR",
Funko POP! Vinyl #345 Mandalorian Chrome - Beskar armor Star Wars - IN STOCK,"34,42 EUR",
The MANDALORIAN BILLET 1 MILLION DOLLAR US! BABY YODA STAR WARS Mando serie Jedi,"1,99 EUR",
Star Wars Black Series - Biker Scout Return of the Jedi 40th Anniversary,"35,86 EUR",
Llavero de metal importado del Reino Unido con logotipo de la Academia Jedi,"14,97 EUR",
THE FORCE AWAKENS METÁLICO VALS DISNEY WORLD STAR WARS NUEVA TARJETA DE REGALO Vertical,"3,45 EUR",
Star Wars Imperial Snowtrooper HK 1980 ESB Vintage Action Figure Kenner,"20,00 EUR",
Star Wars Black Series (Galaxy's Edge) Dok-Ondar,"64,41 EUR",
Micro Machines Star Wars Bib Fortuna Head Playset 1996,"6,90 EUR",
Coffret Figurines Star Wars Force Link Rathar Hasbro,"19,99 EUR",
STAR WARS - Dark Vador - Figurine Hasbro Kenner Vintage Collection 10cm,"24,90 EUR",
STAR WARS - Episode IX - Sith Trooper 2-Pack ArtFX+ 1/10 Pvc Figure Kotobukiya,"172,90 EUR",
Star Wars The Vintage Collection Star Wars: Return of the Jedi Han Solo,"21,45 EUR",
Figura Clone Trooper Utapau Star Wars,"13,00 EUR",
Star Wars Return of the Jedi Super Nintendo SNES *EMBALAJE ORIGINAL* *PAL* *CIB*,"149,95 EUR",
Star Wars The Retro Collection Figurines 10cm Choose Figures Sol Mae Anysea Lon,"26,99 EUR a 34,99 EUR",
"STAR WARS SCACCHI DEAGOSTINI "" BATTLE DROID SECURITY PEDONE NERO ""","6,99 EUR",
Star wars Clones commander Baccara minifigure,"13,00 EUR",
BITTY POP FUNKO STAR WARS - CHOOSE YOUR MINIFIGURE - NEW NUOVO NEUF DISNEY 2023,"9,90 EUR a 14,90 EUR",
"Insignia prendedor de metal esmaltado sable de luz de la película de Star Wars Darth Vader 1,4""","5,19 EUR",
BUSTE STAR WARS ALTAYA. HOMME DES SABLES TUSKEN,"25,00 EUR",
Figura Ahsoka Tano Star Wars The Mandalorian Black Series Hasbro,"28,90 EUR",
Star Wars The Black Series #19 Mace Windu - Figures (10 CM),"8,33 EUR",
Star Wars Miniatures - Clone Trooper (Choose which one you want) - WOTC,"1,50 EUR",
Star Wars Separatist Forces Droid Army Hasbro 2003,"38,50 EUR",
Figura Lego Star Wars - Gungan Soldat sw0302,"6,99 EUR",
Han Solo Star Wars Individual 2D Careta de Cartón Fiesta,"5,72 EUR",
"""Lote de 6 vitrinas acrílicas Star Wars serie negra para caja angular de 6""""""","86,44 EUR",
Expositor de montaje en pared para Lego Star Wars UCS X-Wing,"34,57 EUR",
➠ Topps Star Wars Living Set #363 Poggle El Menor - El Ataque de los Clones,"8,99 EUR",
Cover Star Wars per Iphone 15-14-13-12-11,"8,00 EUR",
Star Wars EP. V BOBA FETT Action figure Diamond Select Disney Store Exclusive,"79,99 EUR",
,,
,,
LEGO Star Wars Minifigure - Max Rebo (read description),"12,06 EUR",
Star Wars The Vintage Collection Figurine 10cm - Figures Jetpack Trooper,"39,99 EUR",
[Star Wars] Funko Pop! Rey #114 - Walgreens,"23,10 EUR",
Star Wars: Hasbro The mandalorian Vintage Collection The Mythrol 10 cm,"24,90 EUR",
Star Wars The Black Series 3.75 Jyn Erso Rogue One Hasbro Figure,"9,00 EUR",
The Mandalorian. Retro Collection. Star Wars: The Mandalorian Hasbro,"9,68 EUR",
Star Wars The Black Series Star Wars: The Phanton Menace Padmé Amidala,"30,45 EUR",
Star Wars Episode VI Retro Collection Figura Luke Skywalker (Jedi Knight) 10 cm,"20,95 EUR",
LEGO Star Wars R2-D2 Droide Astromecánico + Princesa Leia Holograma Minifigura 75270,"16,13 EUR",
PRINCESS LEIA ORGANA IN EWOK CELEBRATION OUTFIT - STAR WARS - POTF- 1998 ¡NUEVO!,"12,99 EUR",
Lego Star Wars minifigura sw0161a C-3PO,"5,25 EUR",
LEGO 25 Jahre Star Wars Schlüsselanhänger - Keychain Keyring R2-D2 25th 107544,"16,99 EUR",
Figuras de Star Wars #5 paquetes de batalla desatados Hasbro Marx soldados de juguete de plástico,"5,71 EUR a 9,16 EUR",
LEGO STAR WARS 75192 - MILLENNIUM FALCON - SPECIALE COLLEZIONE,"892,64 EUR",Vendedor autorizado de LEGO
Funko Pop! Star Wars - Luke & Leia Jedi Training NY Comic Con 2020 #399-400,"99,95 EUR",
STAR WARS - Rey Descendant of Light ArtFX Artist 1/7 Pvc Figure Kotobukiya,"242,43 EUR",
Star Wars Action Figure 1/6 Darth Vader (Battle Damaged) Deluxe Version PREORDER,"699,99 EUR",
Star Wars - Black Series Archive Death Trooper,"24,95 EUR",
SERIE STAR WARS BLACK - ATAQUE DE LOS CLONES - SUPER DROIDE DE BATALLA #06,"31,99 EUR",
STAR WARS - CHASSEUR NABOO N-1 Starfighter - Métal - Die Cast ALTAYA #21 - Rare!,"59,90 EUR",
Star Wars Black Series Galaxy's Edge R5-p8,"29,90 EUR",
Figura Pyke Soldier Star Wars Black Series Hasbro The Book Of Boba Fett Nuevo,"32,00 EUR",
Cassian Andor Star Wars Rogue One Action Figure Hasbro The Black Series,"25,00 EUR",
Star Wars Black Series 40th Anniversary - ROTJ - Paploo - Neuf,"35,00 EUR",
FIGURA AHSOKA TANO 15 Cms STAR WARS NUEVO The Mandalorian Hasbro Kenner Vintage,"14,95 EUR",
Hasbro - Star Wars The Vintage Collection - Comte Dooku - Episode II,"23,87 EUR",
WEEQUAY SKIFF GUARD - STAR WARS - THE POWER OF THE FORCE- 1997 - ¡NUEVO!,"12,99 EUR",
STAR WARS HASBRO 1999 EPISODE 1 . DELUXE . OBI-WAN KENOBI .NEUF SOUS BLISTER,"15,00 EUR",
[Star Wars] Action Figure Vintage Anh RD-D2 AF (15 cm),"22,89 EUR",
Pegatinas Star Wars - Paquete de 700 pegatinas - El despertar de la fuerza **SELLADAS**totalmente nuevas,"14,39 EUR",
Álbum de fotos personalizado carpeta de 3 anillos de Star Wars Trilogy para tarjetas coleccionables vintage,"34,57 EUR a 36,88 EUR",
STAR WARS Kenner Vintage - R2-D2 Action Figure (3 3/4 Scale),"14,95 EUR",
"'DIE CUT' STICKERS for STAR WARS VINTAGE R2D2 CUSTOM VARIATIONS, P DROID, ETC","6,55 EUR",
"Star Wars Colección Vintage Comandante Imperial Suelto 3.75"" Oficial Capitán","23,05 EUR",
Topps Star Wars Chrome 2024 Blaster Box Boite de 8 packs dont 4 refractor,"44,99 EUR",
STAR WARS X-WING 2.0: TIE DEL MAYOR VONREG - FFG - ESPAÑOL FRANCES PRECINTADO,"13,90 EUR",
Hot Toys Star Wars The Mandalorian - Swoop Bike,"250,59 EUR",
Star Wars Samurai Taisho Darth Vader Bandai Action Figure,"75,00 EUR",
Star Wars / The Mandalorian - Complete Retro Collection Figures - 100% NEW,"195,00 EUR",
Star Wars Darth Vader Look-ALite LED Mood Light Lamp 25 cm,"39,99 EUR",
Vintage Star Wars Promo & Merchandising - Episode I LCD Watch Darth Maul,"9,99 EUR",
Star Wars E5 40Th Anniversary Figures - Princess Leia Organa,"26,95 EUR",
Star Wars Mara Jade Expanded Universe 1998 Kenner,"39,00 EUR",
Pegatinas de repuesto vintage de Star Wars Millennium Falcon peeling y palo de juguete,"12,56 EUR",
LEGO Star Wars - Ahsoka Tano - Figur Minifig Jedi Clone Wars Asoka 75283 75310,"14,99 EUR",
"STAR WARS - The Mandalorian & Child Deluxe 1/6 Action Figure 12"" TMS015 Hot Toys","612,10 EUR",
star wars Hasbro Rey’s Speeder Neuf Black Series New,"70,00 EUR",
FIGURINE STAR WARS LUCASFILM DISNEY : LANDO CALRISSIAN,"5,50 EUR",
STAR WARS : OBI-WAN KENOBI - The Black Series - Figurine COMMANDER APPO - Hasbro,"26,90 EUR",
Figura POP Star Wars Mandalorian Heavy Infantry Mandalorian,"21,19 EUR",
"LEGO Star Wars SW1207 - Clone Trooper, 187th Legion (LEGO 75342) minifigura NUEVO","11,99 EUR",
HASBRO STAR WARS THE BLACK SERIES THE MANDALORIAN: IG-12 & GROGU.,"49,90 EUR",
Tarjeta Topps Journey To Star Wars The Rise Of Skywalker Reino Unido <elige> Edición Limitada,"4,76 EUR",
Star Wars The Black Series - Deluxe Droideka Destroyer Droid - The Phantom Menac,"54,39 EUR",
"STAR WARS 25, 38, 59mm insignia/imán/abridor de botellas. Mandalorian Grogu Mando","1,42 EUR a 2,88 EUR",
"STAR WARS The Mandalorian - Heavy Infantry 1/6 Action Figure 12"" TMS010 Hot Toys","507,12 EUR",
Star Wars The Black Series Clone Commander Cody Aniversario PRE-ORDEN,"51,86 EUR",
Llave Sabine Topps Star Wars Base 2024 Serie 2 Nivel 1 White Hoard (x500),"8,06 EUR",
Star Wars: The Empire Strikes Back - Luke Snowspeeder Pilot Statue,"107,67 EUR",
Boba Fett / Star Wars The Mandalorian - Black Series Credit Collection 2022,"35,00 EUR",
,,
,,
"STAR WARS THE BOUNTY COLLECTION S6 &amp; S7 2.25"" MINI FIGURAS COLECCIÓN...","16,71 EUR",
Star Wars Retro Collection Mandalorian Prototype Action Figure Casco Blu,"17,00 EUR",
Star Wars Episode VI Deluxe Action Figura 1/6 Luke Skywalker Deluxe 30 Cm Sidesh,"326,80 EUR",
[Star Wars - The Black Series] Action Figure Ahsoka Tano (Ahsoka),"31,40 EUR",
LEGO® Star Wars Luke Skywalker Minifigure Jedi Bespin Outfit 75222 sw0971,"20,37 EUR",
Ultra Rare STAR WARS CODE 3 MILLENIUM FALCON NEW SEALED,"2.999,00 EUR",
Moff Gideon Carbonized. The Vintage Collection. Star Wars Hasbro,"19,02 EUR",
Funko Pop Star Wars - The Force Awakens - Pick from list,"10,00 EUR a 60,00 EUR",
Figurine Star Wars Vintage Ewok Logray LFL 1983 Kenner SW Complet B-1 no Luke #2,"34,99 EUR",
Star Wars Micro Galaxy Squadron #0114 Destroy The Death Star Battle Pack,"88,42 EUR",
Star Wars The Legacy Collection Captain Needa BD40 2008,"40,33 EUR",
"Reproducción de pistola escotilla superior Kenner Star Wars AT-ST, L@@K","8,07 EUR",
Star Wars Black Series Leia Organa Yavin 4 The Power Of the Force 50th,"19,90 EUR",
STAR WARS THE MANDALORIAN NEVARRO CANTINA KENNER VINTAGE IMPERIAL DEATH TROOPER,"49,99 EUR",
Star Wars Hasbro The Vintage Collection Deluxe Boba Figure (Tatooine),"29,00 EUR",
Star Wars X Wing Lámpara Luz Sith Jedi Merch Fan Luke Skywalker R2D2 Han,"69,90 EUR",
Lego Star Wars 75084 Wookiee Gunship 100% completo con figuras BA caja original,"129,90 EUR",
Juego The Armorer's Forge 💫Star Wars: Colección Vintage Nuevo en caja,"68,59 EUR",
Star Wars R2-Q5 Kotobukiya ARTFX+ 1/10 COME NUOVO SCATOLA OTTIMA,"110,00 EUR",
PRINCESS LEIA IN CEREMONIAL DRESS - STAR WARS - THE POWER OF THE FORCE - 1998,"26,99 EUR",
LUKE SKYWALKER X-WING PILOT (SABLE CORTO) - STAR WARS - POTF- 1995 - ¡NUEVO!,"15,99 EUR",
Tienda de Japón Disney [STAR WARS SAGA] Pegatina Cambiante (EP2),"16,13 EUR",
MOMAW NADON (HAMMERHEAD) - STAR WARS - THE POWER OF THE FORCE - 1997 - ¡NUEVA!,"21,99 EUR",
"BOITE NEUVE - SEALED BOX STAR WARS BLACK SERIES 2013 3.75"" DARTH VADER #06","14,99 EUR",
ULTIMATE GUARD - FUNDA BLISTER CASE S1 PARA FIGURAS KENNER HASBRO STAR WARS,"3,89 EUR",
Bitty Pop Star Wars Serie 1 Completa,"75,00 EUR",
Funko Pop! Número 307 - Star Wars - Rey,"9,00 EUR",
Figurine Star Wars tatooine stormtrooper 1996 sandtrooper,"9,99 EUR",
Star Wars Force Link Chirrut Imwe & Baze Malbus Action Figures,"11,00 EUR",
STAR WARS KYLO REN EPISODE VII plush-toy plüsch 25cm,"25,95 EUR",
Hot Toys 1/6 Mace Windu MMS681 Star Wars Episodio II NUOVO,"400,00 EUR",
FIGURA THE CLIENT STAR WARS The Black Series NUEVO Hasbro,"12,95 EUR",
Figura Kenner Original Princesa Leia 1977 Star Wars Vintage Hong Kong First 12,"25,71 EUR",
Lego portachiavi dado star wars 6012306,"18,00 EUR",
Tarjetas coleccionables 1995 Topps Star Wars El Retorno del Jedi Widevision tú eliges-1,"1,21 EUR",
"Star Wars Stormtrooper, scala 1/6. RAH242 Medicom Toys 2005","125,00 EUR",
gioco figure toys STAR WARS DeAgostini Navicella MILLENIUM FALCON,"15,90 EUR",
Star Wars Elite Series 6'' 15cm Die Cast C-3PO Disney,"45,00 EUR",
LEGO Star Wars Minifigure - Commander Gree (read description),"12,06 EUR",
Tursken raider / Star Wars The Mandalorian - Black Series Credit Collection 2022,"35,00 EUR",
MicroMachines Space Star Wars Rebel Forces Neuf,"20,00 EUR",
"Star Wars, Hasbro, The Black Series 6"" / 15 cm - Migs Mayfeld (The Mandalorian)","12,99 EUR",
Juego de 9 cartas de oro 23K con licencia de Star Wars gema graduada como nueva serie 10 DARTH VADER,"91,01 EUR",
Home One: War Room - Death Star II - Star Wars CCG,"9,60 EUR",
KINDER FERRERO SORPRESINE SCEGLI FIGURE SERIE HIPPO STAR WARS HIPPERIUM TOP RAR,"1,50 EUR a 29,95 EUR",
LEGO Minifigurine Star Wars - Battle Droid - L104,"1,11 EUR",
Star Wars La Serie Negra - Ceremonia de la Princesa Leia Yavin - Una Nueva Esper,"33,22 EUR",
Star Wars Black Series Teeka (Jawa) Obi-Wan Kenobi In Stock / Ready to Ship,"24,90 EUR",
"Action Figure Star Wars The Black Series ""Finn Jakku""","10,00 EUR",
star wars vintage kenner 1982 4-LOM BOUNTY HUNTER 100% ORIGINAL COMPLETE,"38,99 EUR",
Figuras de microfuerza de Star Wars Fighter Pods - Completa tu colección,"2,86 EUR",
DARTH MAUL (FINAL DUEL) - STAR WARS - POWER OF THE JEDI - 2000 - ¡NUEVA!,"23,99 EUR",
TARJETA DE REGALO WALT DISNEY STAR WARS MANDALORIAN ACCIÓN DISNEYLAND,"3,45 EUR",
LEGO Star Wars - Hunter - Figur Minifigur Tech Bad Batch Clone Wars 99 75314,"16,99 EUR",
Star Wars figure Zutton Snaggletooth Mos Eisley cantina ANH POTJ 2001,"12,00 EUR",
Funko Pop Star Wars - The Last Jedi - Pick from list,"5,00 EUR a 50,00 EUR",
PVC Figure Ewoks Star Wars 1986 Comics Spain,"44,99 EUR",
STAR WARS VINTAGE - Bib Fortuna - 83-84 - ROJ - Kenner - Loose C8,"24,90 EUR",
Star Wars Episode I R2-D2 Puzzle 3D Hasbro Con Scatola Vocale Vintage,"12,00 EUR",
STAR WARS CAPTAIN PHASMA EPISODE VII plush-toy plüsch 25cm,"25,95 EUR",
,,
,,
"Disney Store Star Wars El Despertar de la Fuerza. Figura Finn PVC Suelta.3.5"" Nueva","14,39 EUR",
Escultura de Cabeza Darth Vader Personalizada Star Wars Black Series DAÑO DE BATALLA impresa en 3D,"24,77 EUR",
FIGURA DE ACCIÓN STAR WARS VINTAGE COLLECTION 1:18 3.75 TVC JABBA'S COURT DENIZEN 4,"103,73 EUR",
STAR WARS Ewan McGregor Obi-Wan Kenobi TV Action Figure DX26 Hot Toys Sideshow,"599,00 EUR",
Star Wars figure Zutton Snaggletooth Mos Eisley cantina ANH POTJ 2001,"12,00 EUR",
Funko Pop Star Wars - The Last Jedi - Pick from list,"5,00 EUR a 50,00 EUR",
PVC Figure Ewoks Star Wars 1986 Comics Spain,"44,99 EUR",
STAR WARS VINTAGE - Bib Fortuna - 83-84 - ROJ - Kenner - Loose C8,"24,90 EUR",
Shadow Stormtrooper 2006 Star Wars The Saga Collection~SW Online Shop Exclusive,"20,00 EUR",
FIGURA GALEN ERSO STAR WARS The Black Series NUEVO PRECINTADO Hasbro Rogue One,"12,95 EUR",
Star Wars Throne Room Duel Darth Vader 2003,"24,50 EUR",
Hasbro Star Wars Unleashed Shadow stormtrooper Diorama,"49,00 EUR",
Star Wars The Vintage Collection Cal Kestis (Imperial Officer Disguise),"20,95 EUR",
Star Wars HAN SOLO bobble head 16cm Funko Wacky Wobbler,"28,00 EUR",
STAR WARS - La minaccia fantasma (1999) Poster Manifesto Locandina del film 260,"12,99 EUR a 17,99 EUR",
STAR WARS - Ben Kenobi 1/10 Deluxe BDS Art Scale Statue Iron Studios,"269,10 EUR",
Stormtrooper Mimban Action Figures Star Wars Force Link 2.0 Supremo Jedi CM 9,"22,90 EUR",
Lego® Star Wars Tin Box Yoda + Kylo Ren + Boba Fett tarjetas + figura + refuerzo,"23,97 EUR",
Figura POP Star Wars Moroff Jedha Exclusive,"21,19 EUR",
Star Wars Black Series Credit Collection Mandalorian Exclusive Hasbro 2021,"24,90 EUR",
"Star Wars Black Series Darth Maul , Qui Gon , Obi Wan Kenobi 3 Pack Episode 1","104,90 EUR",
7 PIEZAS STAR WARS Micro Galaxy Squadron Mini Figuras Soldado Clon RARO Suelto,"49,51 EUR",
"Figura de acción Hasbro Star Wars Kylo Ren 6"" Black Series 2016 SDCC Collection","37,40 EUR",
Stormtrooper Star Wars Máster Replicas Helmet,"190,00 EUR",
Lego sw1320 Minifig Star Wars - Droïde / Battle droid avec Speeder STAP - NEW,"5,49 EUR",
STAR WARS VINTAGE SERIES OFFWORLD JAWA (ARVALA-7),"21,95 EUR",
2024 Throwback Thursday Star Wars Edición #45 - Tarjeta 133 Huyang -,"9,21 EUR",
Star Wars Rebel Assault Sega Sega MEGA-CD / Repro Boitier et disque,"17,90 EUR",
STAR WARS - Luke Skywalker X-Wing Pilot Ver. ArtFX+ 1/10 Pvc Figure Kotobukiya,"177,40 EUR",
STAR WARS - Episode IX - Kylo Ren ArtFX+ 1/10 Pvc Figure Kotobukiya,"162,10 EUR",
Star Wars The Black Series - Baylan Skoll (Mercenary) - Ahsoka,"34,77 EUR",
Topps Star Wars Base 2025 Serie 1 Nivel 1 Tesoro Blanco (x500) - El Fantasma,"4,60 EUR",
"Speeder Bike - Star Wars (Kenner, 1983)","120,00 EUR",
Star Wars Vintage Collection Luke Skywalker Hoth In Stock,"14,90 EUR",
The Last Command. The Black Series. Star Wars Hasbro,"123,49 EUR",
FIGURA WOOKIEE Halloween Edition STAR WARS The Black Series NUEVO Hasbro,"18,95 EUR",
"STAR WARS Kenner Hasbro - SAGA COLLECTION - Yoda AOTC 12"" MISB NEW","95,00 EUR",
STAR WARS Kenner Hasbro Action Figure - POTF POTF2 - Hoth Rebel Soldier,"12,90 EUR",
Stormtrooper / Rey / Darth Vader : Star Wars The force awakens - Build a weapon,"33,00 EUR",
Star Wars Episodio VII Statua Rey Discendente della Luce ARTFX 27 cm Kotobukiya,"242,73 EUR",
Calcomanías de Star Wars Armada para paquete de expansión ROGUES AND VILLANINS,"14,97 EUR",
Star Wars Retro Collection A New Hope 6 multi pack MISB,"200,00 EUR",
Star Wars Chewbacca Retro Series Pop! Funko vinyl figure special edition n° 570,"19,54 EUR",
"TRAIDOR, LA NUEVA ORDEN JEDI MATTHEW STOVER BIBLIOTECA STAR WARS GUERRA GALAXIAS","22,75 EUR",
Star Wars Nº 50 Variante Cubierta B Neuware 2024 Nuevo,"8,80 EUR",
Figura POP Star Wars 40th Princess Leia,"21,19 EUR",
STAR WARS Power of the force giftset 1996 - SPEEDER BIKE + Luke,"35,00 EUR",
STAR WARS - RETRO COLLECTION - IG 11 - THE MANDALORIAN - FIGURINE 10 CM - 8827,"19,99 EUR",
"Rebel Trooper Concept #60 Star Wars 30 aniversario sin usar, en caja nuevo D1","16,70 EUR",
STAR WARS DARTH VADER CLOUD CITY KOTOBUKIYA ARTFX+ Scala 1:10 Action Figure,"100,00 EUR",
"TARJETAS DE ACTUALIZACIÓN DE SISTEMA/TECNOLOGÍA, STAR WARS X-WING MINIATURAS (1a), FFG","1,44 EUR a 3,60 EUR",
STAR WARS Battlefront II 2 SUPER BATTLE DROID Loose COMPLETE,"12,90 EUR",
STAR WARS - Tamashii Stage for S.H. Figuarts Action Figure Bandai,"37,71 EUR",
2 Figuras The Mandalorian Mines Of Mandalore Y Grogu Vintage Collection Hasbro,"45,00 EUR",
Tienda de Japón Disney [STAR WARS SAGA] Pegatina Cambiante (EP6),"16,13 EUR",
Hot Toys Star Wars MMS319 First Order Stormtrooper,"255,00 EUR",
Mandalorian Shriek-Hawk Trainers Pack 2 Fig. 15 Cm Star Wars: The Mandalorian Th,"45,95 EUR",
Hyper Escape - Premiere Limited - Star Wars CCG,"1,00 EUR",
STAR WARS VINTAGE FIGURINE MANDALORIAN DIN DJARIN BESKAR ARMOR 10cm HASBRO DISPO,"24,99 EUR",
Action Figure Star Wars Saga Legends “Chewbacca”,"30,00 EUR",
,,
,,
Star Wars Obi Wan Kenobi Retro Collection Action Figure 10 cm,"26,50 EUR",
Funko POP ! 3-pack Star Wars: Tarfful Unhooded Emperor Utapau - NEW!!!,"42,84 EUR",
"FUNKO POP GROGU STAR WARS N° 482 ""LUKE SKYWALKER WITH GROGU"" - NEUF en Boîte !","9,95 EUR",
"STAR WARS - The Mandalorian - Boba Fett 1/6 Action Figure 12"" TMS033 Hot Toys","421,30 EUR",
"MAGNAGUARD ""JEDI SURVIVAL"" VC188 STAR WARS LA COLECCIÓN VINTAGE HASBRO","1,99 EUR",
Topps Star Wars Rise of Skywalker elige tarjetas de inserción especial inc edición limitada,"2,73 EUR a 21,59 EUR",
Star Wars: Skeleton Crew Season 1 DVD 2-Disc New Sealed Box All Region Free Post,"17,46 EUR",
"OSHA ANISEYA VC327 ""EL ACÓLITO"" STAR WARS LA COLECCIÓN VINTAGE HASBRO","5,73 EUR",
Action Masters Star Wars Luke Skywalker - Die cast metal collectibles - Kenner,"14,90 EUR",
Figura de acción Kenner Star Wars. Teebo 1983. Completa.,"30,00 EUR",
"1:12 Scale 2pcs STAR WARS BLACK SERIES Red Lightsaber Weapons for 6"" FIGURE","4,81 EUR",
Ombres de la galaxie- RARES à L'unité -Star Wars Unlimited FR,"1,00 EUR a 7,00 EUR",
➠ Topps Star Wars Living Set #314 Luke Skywalker - Star Wars: The Last Jedi,"6,99 EUR",
Figure Star Wars Yoda,"160,00 EUR",
Star Wars: Tales of the Empire: 2024 1 Disc 1080P All RegionPlay Seal Box,"16,48 EUR",
[Star Wars] Funko Pop! Ahsoka Tano #658 - Target,"31,40 EUR",
Star Wars Rebels : Ezra Bridger / Kanan Jarrus / Cpt. Rex - lot de 3 / 2015,"48,00 EUR",
Brick Shine- Light Kit for LEGO Star Wars Slave I 75060 (Top-Rated Seller),"58,77 EUR",
STAR WARS THE VINTAGE COLLECTION VC116 REY JAKKU,"20,00 EUR",
Topps Star Wars Card Trader BOUNTY 2025 Semana 2 Reina Amidala Naranja Verde Rojo,"3,97 EUR",
Lego Minifigure Star Wars - Shadow Guard (sw0604) Set 75079,"6,29 EUR",
"STAR WARS VINTAGE | Bib Fortuna | Kenner 1983 | HK | Jabba's Court | 3,75""","6,90 EUR",
Kenner Millennium Falcon 1979 Vintage Star Wars Juego de pegatinas de repuesto + BONO,"6,97 EUR",
Star Wars The Vintage Collection IG-11,"21,45 EUR",
Luke Skywalker Fig. 15 Cm Star Wars: A New Hope The Black Series,"26,95 EUR",
Star Wars: Mythos Statue Darth Vader 63 cm,"1.190,00 EUR",
Póster de la película 1977 Star Wars 4 A New Hope arte lienzo HD impreso decoración de pared,"5,98 EUR a 13,48 EUR",
Monedas 50 peniques Star Wars 2023-2024 - personajes y acorazados,"11,41 EUR a 11,52 EUR",
Figura POP Star Wars B2EMO Exclusive,"29,95 EUR",
[Star Wars] Funko Pop! Ree Yees #95 - Walgreens,"23,10 EUR",
LEGO® - Minifiguras - Star Wars - sw1333 - Darth Maul (75383),"9,80 EUR",
Fascinations ICONX Star Wars Mandalorian's N-1 STARFIGHTER Metal Tierra Kit,"42,59 EUR",
