Title,Price,Sales
,,
,,
Star Wars Snowtroopers 3.75 inch collection,"10,00 EUR",
Star Wars Obi Wan kenobi Clone wars Legacy Collection 3.75 inch collection,"10,00 EUR",
Imperial Speeder Bike Star Wars Power of the Force Kenner 1995,"39,50 EUR",
star wars a New Hope Han Solo with quick draw action 2002,"15,00 EUR",
Luke Skywalker. The Black Series. Star Wars: A New Hope Hasbro,"32,49 EUR",
2021 TOPPS STAR WARS THE MANDALORIAN CHARACTER YELLOW PARALLEL,"1,00 EUR",
Figura POP Star Wars Ahsoka 2 Thrawns Night Trooper,"21,19 EUR",
Set figura POP & Tee Star Wars Mandalorian L,"25,00 EUR",
 Star Wars vintage Kenner Luke X-Wing pilot 2l/HK CoO. White face,"15,00 EUR",
Star Wars Kenner figuras 1977 Lote 2 de 55 muñecos con 31 Armas,"330,00 EUR",
Lote De 3 Cajas Vintage Star Wars Hasbro,"60,00 EUR",
"Obi-Wan Kenobi, Darth Maul, Qui-Gon Jinn. The Black Series. Star Wars: The Phant","100,42 EUR",
Music from The Star Wars Trilogy,"15,26 EUR",
Star Wars. Atlas Galáctico,"19,66 EUR",
Star Wars Coding Projects,"19,16 EUR",
"Star Wars - Trilogie: Der Anfang, Episode I-iii","16,02 EUR",
Phantom Menace Multipack. Star Wars Retro Collection. Hasbro,"54,52 EUR",
star wars Reek Electronic Beast with sound and movement,"10,00 EUR",
PC Star Wars: Jedi Survivor,"11,99 EUR",
Droide Star Wars BB-8 - 18 OZ. Taza de café de cerámica - Vandor de gran tamaño,"23,04 EUR",
star wars phantom menace Darth Maul figure,"5,00 EUR",
MEMORABILIA STAR WARS DISNEY 'CHEWIE' MEDIAS DE NAVIDAD Nuevas con Etiquetas,"5,93 EUR",
star wars lotes,"225,00 EUR",
HASBRO STAR WARS E3 VULTURE DROID REVENGE OF THE SITH RARE NEW IN BOX MOC,"39,99 EUR",
"star wars HASBRO 12"" LUKE SKYWALKER STORMTROOPER WITH DIANOGA TENTACLE MIB","29,99 EUR",
"LEGO Star Wars: UCS Slave I - Jango Fett's Slave 1 sin usar, en caja + minifiguras y placa","30,50 EUR",
Jedi Master Vernestra Rwoh. The Black Series. Star Wars Hasbro,"32,49 EUR",
star wars vintage kenner Luke Skywalker Bespin,"10,00 EUR",
Star Wars Rebels - Temporada 3,"15,46 EUR",
Star Wars 7 : Le Réveil de la Force,"16,40 EUR",
Star Wars: Episodio V. el Imperio Contraataca,"23,72 EUR",
Star Wars: The Clone Wars Temporada 2,"23,58 EUR",
SALE! STAR WARS Black Series LUKE SKYWALKER (JEDI KNIGHT) ROTJ 40th Anniversary,"30,95 EUR",
star wars kenner vintage Stormtrooper. Tropa de asalto.,"150,00 EUR",
Dagan Gera. The Black Series Gaming Greats. Star Wars Jedi: Survivor Hasbro,"32,49 EUR",
Star Wars Micro Ships Miniatures | 1994 | Micro Máquinas,"1,18 EUR",
Star Wars: Skeleton Crew DVD 2-Disc New Sealed Box Set All Region Free Shipping,"17,45 EUR",
LEGO Star Wars 12x Droide de Batalla con General Grievous - TOTALMENTE NUEVO,"11,87 EUR",
Star Wars - The Clone Wars. Raumschiffe Und Fahrzeuge. .,"18,37 EUR",
Aprende Coding con Star Wars,"15,70 EUR",
Star Wars The Black Series Stormtrooper First Order 2017,"25,00 EUR",
Star Wars The Power of the Force Ben (Obi Wan) Kenobi Kenner 1995,"15,50 EUR",
Star Wars Black Series Archive Emperor Palpatine,"19,90 EUR",
Figuras STAR WARS BOTTLE CAP PEPSI,"2,00 EUR",
STAR WARS ARMADA - INTERDICTOR - FFG - ESPAÑOL PRECINTADO,"53,95 EUR",
Star Wars Darth Plagueis Black Series,"130,00 EUR",
LEGO Star Wars Minifigure - Darth Revan (read description),"12,06 EUR",
Star Wars commander Cody Clone wars 3.75 inch collection,"10,00 EUR",
"Star Wars Force Link 2.0 qi'ra (Corellia) 3.75"" Movie Action Figure","4,50 EUR",
Micros & Flauta Max Reboo Band Star Wars Kenner,"19,50 EUR",
Figura Star Wars Edrio Two Tubes,"9,00 EUR",
Pack Star Wars Podracer Pilots Episode 1 Hasbro,"45,00 EUR",
LUKE SKYWALKER Star Wars The Power Of The Force Japan kenner 1995,"14,50 EUR",
Obi-Wan Kenobi (Padawan). The Black Series Archive. Star Wars Hasbro,"30,81 EUR",
Cal Kestis (Imperial Officer Disguise). The Vintage Collection. Star Wars Hasbro,"21,13 EUR",
Minifigure Star Wars Saga da Games and Comics-LEIA-OBI-WAN KENOBI-YODA-FILM-NEW,"3,00 EUR a 8,00 EUR",
star wars Super Battle Droid 2002,"10,00 EUR",
Habsro star wars the black series 94 the mandalorian carbonized,"50,00 EUR",
"Star Wars: Princesa Leia, Volumen 1: Numero 04","15,11 EUR",
Star Wars: Episodio Vi. el Retorno Del Jedi,"15,05 EUR",
,,
,,
Star Wars el Libro de los Sith,"16,35 EUR",
Star Wars: Episodio Vi. el Retorno Del Jedi,"15,05 EUR",
Star Wars: The Complete Visual Dictionary - The Ultimate Guide to Characters And,"17,60 EUR",
Mi Laboratorio Star Wars : 20 Proyectos de Manualidades Cientãficas,"21,90 EUR",
Star Wars Black Series Archive Emperor Palpatine,"19,90 EUR",
2021 TOPPS STAR WARS THE MANDALORIAN CHARACTERS BASE (SILVER/GREY),"1,00 EUR",
star wars kenner vintage Stormtrooper. Tropa de asalto.,"150,00 EUR",
Figura de acción Kenner Star Wars. Guardia Imperial. 1983. Completa.,"40,00 EUR",
Star Wars Scatole Kenner Hasbro Disney 1996 Perfette Mai Aperte,"10,00 EUR a 130,00 EUR",
Figurine 30 Cm Star Wars Baby Yoda,"15,00 EUR",
Star Wars Black Series Darth Maul The Phantom Menace,"32,90 EUR",
Star Wars Yoda Episode 1 1999 Hasbro,"10,00 EUR",
Star Wars. Obi-123. Aprendo con Disney,"21,24 EUR",
Star Wars Rebels. el Problema Del Luchador,"16,23 EUR",
Star Wars las Guerras Clon: Medstar Ii: Curandera Jedi,"21,29 EUR",
Star Wars Brian Wood Nº 01/04,"19,99 EUR",
Luke Skywalker (Imperial Light Cruiser). The Black Series Archive. Star Wars Has,"31,07 EUR",
Star Wars Miniatures - Rebel Faction - No Card,"1,50 EUR",
Star Wars General Grievous Sneak Preview Hasbro 2004,"19,90 EUR",
Star Wars Black Series Darth Sidious,"32,90 EUR",
Nuevo Star Wars Rebels Serie 3 Micro Galaxy Squadron Ghost #0131 18+ Características,"38,62 EUR",
Star Wars Power of the Force Sandtrooper kenner 1996,"19,50 EUR",
Star Wars Ephant Mon ROTJ 2002 Hasbro,"65,00 EUR",
Doctora Aphra. The Black Series. Star Wars Hasbro,"28,12 EUR",
star wars Super Battle Droid 2002,"10,00 EUR",
Star Wars Imperial Assault - Seleccionar miniatura - VERSIÓN EN INGLÉS,"2,00 EUR a 35,00 EUR",
Star Wars Vintage Lobot,"12,00 EUR",
Scout Trooper Bike Micro Galaxy Squadron Star Wars Series 4 Mystery,"13,90 EUR",
Construye Tu Propia Aventura Lego/star Wars,"17,15 EUR",
Star Wars The Complete Película Dvd de la Colección,"20,51 EUR",
Angry Birds Star Wars Wii,"18,37 EUR",
4641451 Trolley rígida de mano en ABS de Star Wars 55x33x20 cm,"92,45 EUR",
Nien Nunb. The Vintage Collection. Star Wars: Return of the Jedi Hasbro,"24,57 EUR",
Star Wars A New Hope Darth Vader's TIE Fighter,"9,21 EUR",
"STAR WARS VINTAGE | Snowtrooper | KENNER | Hong Kong 1980 | | 3,75"" | Hoth","15,00 EUR",
Bo-Katan Kryze. Retro Collection. Star Wars: The Mandalorian Hasbro,"7,23 EUR",
Count Dooku Star Wars Episode II Vintage Collection Figura 10 cm,"19,00 EUR",
Droide Star Wars BB-8 - 18 OZ. Taza de café de cerámica - Vandor de gran tamaño,"23,04 EUR",
Star Wars el Poder de la Fuerza . Pal España .envio Certificado ..paypal,"19,99 EUR",
"Star Wars Rebels. Ezra Rescata a Un Wookiee, de Disney. Editorial Pla en Espaol","16,37 EUR",
Star Wars Hasbro Retro Collection Chewbacca Prototype (orange),"20,00 EUR",
Figuras star wars y complementos,"35,00 EUR",
STAR WARS KENNER 40th RETURN OF THE JEDI-BIB FORTUNA,"35,00 EUR",
DIORAMA STAR WARS DAGOBAH figurines kenner 1995,"30,00 EUR",
STAR WARS EPISODE VI VINTAGE COLLECTION HASBRO 2021 LUKE SKYWALKER (ENDOR) 10 CM,"23,00 EUR",
Star Wars Princess Leia Slave Original Trilogy Collection 2004 Hasbro,"35,00 EUR",
MEMORABILIA STAR WARS DISNEY 'CHEWIE' MEDIAS DE NAVIDAD Nuevas con Etiquetas,"5,93 EUR",
HK-87 STAR WARS THE MANDALORIAN THE BLACK SERIES 15 CM,"19,00 EUR",
STAR WARS HASBRO RETRO COLLECTION IMPERIAL DEATH TROOPER (OBI-WAN KENOBI),"8,99 EUR",
Habsro star wars the black series 94 the mandalorian carbonized,"50,00 EUR",
"STAR WARS RETRO COLLECTION: JAWA (A NEW HOPE) HASBRO, MOSC - UNPUNCHED","29,95 EUR",
 Star Wars vintage Retour of The Jedi Scissors. original 1983,"20,00 EUR",
"¡TÚ ELIGES! Figuras sueltas de Star Wars - Legado, colección vintage, clones y más!!","5,71 EUR a 259,30 EUR",
LEGO Star Wars - Fase 1 Capitán Rex Minifigura - sw0194 - 7675,"43,99 EUR",
"STAR WARS RETRO COLLECTION: DEATH SQUAD COMMANDER, HASBRO, MOSC - UNPUNCHED","24,95 EUR",
 Star Wars vintage PBP Snnaggletooth 2l/ Scar no CoO. Nice condition,"25,00 EUR",
 Star Wars vintage PBP Greedo 2l/ Scar no CoO. Good condition,"30,00 EUR",
LEGO Star Wars - Anakin Skywalker - Figur Minifigur Jedi Ahsoka Tano Vader 75401,"14,99 EUR",
"Loco por Star Wars: Pon a Prueba Tus Conocimientos de Una Galaxia Muy, Muy Lejan","21,57 EUR",
Figura Funko Pop! Star Wars Darth Vader Modelo 01 | 02300 Figura en Vinilo,"18,80 EUR",
,,
,,
Figura Funko Pop! Star Wars Boba Fett Modelo 08 | 02386 Figura en Vinilo,"18,80 EUR",
Figura Funko Pop! Star Wars Grogu El niño con rana Modelo 379 | 49932 Figura en,"17,80 EUR",
426515 Set base Star Wars Force enlace para escuchar sonidos con carácter,"11,51 EUR",
Figura Funko Pop! Star Wars Mandalorian con armadura cromada 380 - 49931 | Gigan,"39,80 EUR",
LEGO STAR WARS MINIFIGURA `` CLONE TROOPER COMMANDER CODY ´´ Ref 75337,"23,95 EUR",
Star Wars Micro Galaxy Squadron Hunter AT-RT series 2 Scout Blind Box New,"28,00 EUR",
EMPEROR'S ROYAL GUARD - STAR WARS - THE POWER OF THE FORCE - 1997 - ¡NUEVA!,"21,99 EUR",
BLI21 Figurine Kenner STAR WARS Power of the Jedi POTJ MIB 2000 : ZUTTON,"7,90 EUR",
"Star Wars figure Imperial Ground Crew Rogue One 3,75"" / 10 cm","9,00 EUR",
STAR WARS ARMADA - INTERDICTOR - FFG - ESPAÑOL PRECINTADO,"53,95 EUR",
Azulejos de superficie Star Wars Estrella de la Muerte - Diorama de trinchera de la Estrella de la Muerte individual o conjunto,"4,75 EUR a 41,61 EUR",
Navicelle Star Wars - Guerre stellari - De Agostini,"1,00 EUR a 19,77 EUR",
Figura Funko Pop! Star Wars Clone Trooper 21 | 06038 Figura en Vinilo,"100,30 EUR",
Figura Funko Pop! Star Wars Grogu usando La Fuerza Modelo 485 | 58390 Outlet son,"20,80 EUR",
Figura Funko Pop! Star Wars Luke Skywalker Modelo 594 | 67536 | Caja Dañada Outl,"18,80 EUR",
Figura Funko POP! Star Wars Mandalorian Modelo 326 | 42062 Figura en Vinilo,"16,80 EUR",
Leia Organa. The Black Series. Star Wars: A New Hope Hasbro,"32,49 EUR",
"Lego Minifigure Star Wars - Royal Guard (sw0521) Set 75034, 75093","5,99 EUR",
Star Wars Black Series Darth Malgus,"79,90 EUR",
Figura Yoda Star Wars The Empire Strikes Back Vintage Collection Hasbro,"25,00 EUR",
STAR WARS Kenner Hasbro Action Figure - EPISODE I - Jabba The Hutt + Announcer,"39,90 EUR",
Boosted TIE Cannon - Premiere Unlimited - Star Wars CCG,"1,00 EUR",
Star Wars Black Series Imperial Armored Commando,"32,90 EUR",
"Figuras de acción Hasbro Star Wars de 3,75 pulgadas: tú eliges","3,45 EUR a 23,04 EUR",
"Figura de acción Star Wars The Black Series Archive - C-3PO 6"" premium ANH F4369","20,74 EUR",
Figura Star Wars Rey Jakku,"3,00 EUR",
LEGO Star Wars Minifigura Yoda #1288,"12,99 EUR",
"STAR WARS RETRO COLLECTION: BEN KENOBI (A NEW HOPE) HASBRO, MOSC - UNPUNCHED","27,95 EUR",
Figura Funko POP! Star Wars Concept Series Yoda Modelo 425 | 50112 Figura en Vin,"18,80 EUR",
Figura Funko Pop! Star Wars Concept Series Han Solo Modelo 472 | 56767 Figura en,"19,80 EUR",
Figura Funko Pop! Star Wars The Mandalorian con Sable Oscuro Modelo 663 | 76550,"18,80 EUR",
Figura Funko Pop! Star Wars Rey (Dorado) Modelo 114 | 43021 Figura en Vinilo,"21,80 EUR",
Star Wars Vintage Collection Jetpack Trooper,"18,90 EUR",
"Star Wars The Black Series 6"" Stormtrooper Jedha Patrol (Ola 41)","26,75 EUR",
Llavero de metal serie Star Wars llavero regalo nuevo,"2,28 EUR a 2,74 EUR",
STAR WARS MINI RING KENNER LFL - ISP-6 - INFANTRY SUPPORT PLATFORM ANNI 80',"30,00 EUR",
Hasbro Collectibles - Star Wars: The Mandalorian - Colección Vintage - The Armo,"67,06 EUR",
"Star Wars figure Luke Skywalker Battle of Endor Saga Collection TSC 2006 3,75""","13,00 EUR",
Figura Funko Pop! Star Wars Reva (Third Sister) Modelo 542 | 64561 Figura en Vin,"16,80 EUR",
Figura Funko Pop! Star Wars Caballero de Ren Con Cañón En Brazo Modelo 334 | 399,"16,80 EUR",
Lego star wars Battle Packs,"28,00 EUR a 55,00 EUR",
Star Wars Unlimited - Takedown 077 (3x Juego) Spark Of Rebellion (Casi Como Nuevo),"2,70 EUR",
Star Wars Vintage Collection Admiral Ackbar Return of the Jedi In Stock,"14,90 EUR",
Figura Pre Vizsla Star Wars Vintage Collection Hasbro,"24,90 EUR",
LEGO Star Wars - Ahsoka Tano - Figur Minifigur Anakin Rebels Wren T-6 Jedi 75362,"9,99 EUR",
Micro Galaxy Squadron Star Wars The Mandalorian Speeder Y Grogu Series 2 Mystery,"14,90 EUR",
Figure R2-d2 2004 Light And Sound Hasbro Star Wars 6cm LFL,"35,00 EUR",
Star Wars figures Jedha Revolt four pack Rogue One Edrio Gerrera Hovertank Jyn,"45,00 EUR",
"STAR WARS RETRO COLLECTION: TUSKEN RAIDER (A NEW HOPE) HASBRO, MOSC - UNPUNCHED","24,95 EUR",
Star Wars The Black Series 13th Battalion Trooper Gaming Greats Hasbro,"24,90 EUR",
"Telón de fondo de pasillo largo estrella de la muerte de 3,75"" Star Wars Hasbro Kenner envío gratis","28,82 EUR",
LEGO STAR WARS Polybags Exclusivos Promocionales Juegos Especiales Raros,"9,50 EUR a 110,99 EUR",
Star Wars Black Series The Clone Wars Mace Windu 50th,"24,90 EUR",
Star Wars Black Series NIGHTBROTHER WARRIOR Jedi Fallen Order Gaming Greats,"19,90 EUR",
Lego Star Wars Gran Almirante Thrawn sw1356,"19,99 EUR",
LEGO® Star Wars™ Minifigura 2 Comandos Imperiales del Set 75373,"9,99 EUR",
LANDO CALRISSIAN - DEATH STAR ATTACK - ROTJ - STAR WARS - SAGA 04/21 2004 NUEVA,"27,99 EUR",
STAR WARS MICRO MACHINES GUERRE STELLARI PLANET TATOOINE JABBA 1995 NUOVO SW7,"49,90 EUR",
Figura Funko Pop! Star Wars Deluxe Darth Vader en cámara de meditación Modelo 36,"40,80 EUR",
Figura Funko Pop! Star Wars Cassian Andor Modelo 534 | 65333 Edición Limitada Co,"24,80 EUR",
,,
,,
Funko Pop! Star Wars El ascenso de Skywalker Jannah Modelo 315 | 39884 Figura en,"13,80 EUR",
Figura Funko Pop! Star Wars Mandalorian Death Watch Modelo 354 | 46091 Edición E,"19,80 EUR",
Figura Funko Pop! Star Wars Boba Fett Modelo 480 | 60236 Figura en Vinilo,"16,80 EUR",
Figura Funko Soda Star Wars Luke Skywalker | 64130 Edición Exclusiva Galactic Co,"15,80 EUR",
LANDO CALRISSIAN - DEATH STAR ATTACK - ROTJ - STAR WARS - SAGA 04/21 2004 NUEVA,"27,99 EUR",
STAR WARS MICRO MACHINES GUERRE STELLARI PLANET TATOOINE JABBA 1995 NUOVO SW7,"49,90 EUR",
STAR WARS ARMADA - ESCUADRONES DE CAZAS REBELDES II - FFG - ESPAÑOL PRECINTADO,"14,95 EUR",
Minifigura de Star Wars Rancor,"23,04 EUR",
Star Wars Black Series Han Solo Power Of the Force 50th Damage Box /Caja dañada,"19,90 EUR",
Hasbro Star Wars The Vintage Collection Rebel Soldier Echo Base 4 Pack Set MISB,"56,07 EUR",
C-3PO Star Wars The Power Of The Force Japan KENNER 1995,"22,50 EUR",
Star Wars Micro Galaxy Squadron Scout Caja SELLADA - Serie 3 - PACK 6,"22,58 EUR",
Figura Funko Pop! Star Wars Tala Durith Modelo 541 | 64560 Figura en Vinilo,"12,80 EUR",
Figura Funko Pop! Star Wars The Rise of Skywalker Rose Modelo 316 | 39888 Figura,"13,80 EUR",
Figura Funko Pop! Star Wars The Rise of Skywalker Lieutenant Connix Modelo 319 |,"13,80 EUR",
Figura Funko Pop! Star Wars Snowtrooper Concept Series Modelo 471 | 56768 Figura,"14,80 EUR",
Star Wars Black Series Darth Vader Duel's End Obi Wan Kenobi Hasbro in Stock,"89,90 EUR",
Kenner Gig 1995 96 Guerre Stellari Star Wars Red Blister Mai Aperti,"14,00 EUR a 32,00 EUR",
 Star Wars vintage PBP Chewbacca Scar no CoO.,"10,00 EUR",
 Star Wars vintage Retour of The Jedi Perk-Up Stickers (2) 1983 original,"20,00 EUR",
Figura Darth Revan Star Wars Vintage Collection Hasbro,"39,00 EUR",
STAR WARS KENNER 40th RETURN OF THE JEDI-BIB FORTUNA,"33,50 EUR",
STAR WARS Grogu The Child Mandalorian 50 ¡Hoja de pegatinas elevadas!,"3,05 EUR",
EMPERORS ARRIVAL VADER CHROME GOLD SAPPHIRE ROTJ EPIC Star Wars Card Trader,"3,60 EUR",
Pines de Disney STAR WARS con cordón de Star Wars,"15,56 EUR",
"Star Wars figure Chirrut Imwe Rogue One Black Series 6""","25,00 EUR",
"STAR WARS poupée 12 "" HASBRO saga 2003 - LEIA ENDOR outfit on speeder bike","230,00 EUR",
Star Wars Covert Ops Clone Trooper StarWarsShop.com Exclusive ROTS Revenge NEW,"22,50 EUR",
Figura Funko Pop! Star Wars Kawlan Roken Modelo 540 | 64559 Figura en Vinilo,"12,80 EUR",
Figura Funko Pop! Star Wars Mandalorian El Cliente Modelo 346 | 45538 Figura en,"14,80 EUR",
Figura Funko POP! Star Wars Madalorian Modelo 495 | 60126 Edición Especial San V,"14,80 EUR",
Figura Funko Pop! Star Wars Deluxe Princesa Leia Modelo 376 | 45901 Edición Espe,"29,80 EUR",
JUEGO DE 12 FIGURAS DE ACCIÓN STAR WARS COLECCIÓN RETRO SUELTAS COMPLETAS,"155,62 EUR",
Figura Teebo Star Wars Return Of The Jedi Vintage Collection Hasbro,"28,90 EUR",
Lego Star Wars C-3PO sw1201,"6,39 EUR",
Star Wars The Power of the Force Zuckuss with Heavy Assault Blaster Rifle 1997,"34,50 EUR",
LOOSE STAR WARS MINT CONDITION SAGA 2003 STORMTROOPER MCQUARRIE CONCEPT,"11,99 EUR",
AT-AT Imperial Walker Kenner Star Wars Loose Part,"4,00 EUR a 10,00 EUR",
Figura Funko Pop! Star Wars Dagoba Yoda con Hut Modelo 11 | 46765 40 Aniversario,"32,80 EUR",
Figura Funko Pop! Star Wars Purge Trooper Modelo 533 | 65334 Edición Limitada Co,"24,80 EUR",
LEGO STAR WARS MINIFIGURA `` SUPER BATTLE DROID ´´ Ref 75372 100X100 LEGO,"2,95 EUR",
LEGO Star Wars - Todo 360 - Figur Minifig Droid Droide Cad Bane Clone Wars 75323,"12,99 EUR",
"Star Wars figure Darth Vader Bespin Black Series Orange BS #06 2013 3,75""","18,00 EUR",
Figura Darth Vader Star Wars Vintage Collection Hasbro,"22,90 EUR",
50 X Minifiguras de Droides de Batalla de Star Wars con 1X Grevious y 1 X TX-20 Totalmente Nuevas,"28,25 EUR",
LEGO STAR WARS MICROFIGHTERS MILLENIUM FALCON + BOBA FETT`S Ref 75295 + 75344,"16,95 EUR",
Obi Wan Kenobi Star Wars Black Series Archive Lucasfilm 50th Anniversary,"21,90 EUR",
Star Wars Power Episode I C-3PO 1998,"14,50 EUR",
Figura Klatooinian Raider The Mandalorian Star Wars Vintage Collection Hasbro,"23,90 EUR",
FIGURA DE ACCIÓN VINTAGE DROIDES KENNER TÍO GUNDY DE STAR WARS IMPRESA EN 3D,"16,65 EUR",
"Star Wars figure Clone Commander Doom Black Series blue BS#13 2015 3,75""","33,00 EUR",
Chase R2d2 Micro Galaxy Squadron Star Wars,"27,00 EUR",
Telón de fondo de gran tamaño Dune Sea Star Wars TVC serie negra Hasbro Kenner,"36,89 EUR",
LEGO Star Wars 75356 Super Star Destroyer™ Executor Nuovo MISB Sigillato,"74,90 EUR",
"Lote de figuras de acción de 3,75"""" de juguete de repuesto corporal de 3,75"""" de Star Wars The Vintage Collection","9,84 EUR a 27,37 EUR",
Figura Migs Mayfeld The Mandalorian Star Wars Vintage Collection Hasbro,"21,00 EUR",
"Star Wars Action Figure Imperial Stormtrooper Rogue One 3,75""/10 cm","20,00 EUR",
NUEVO STAR WARS 30 ANIVERSARIO JEDI STARFIGHTER DE AAYLA SECURA,"37,15 EUR",
Figura Funko Pop! Moment Star Wars Darth Vader VS Luke Skywalker Modelo 612 | 70,"32,80 EUR",
Figura Funko Pop! Star Wars Cad Bane con Todo 360 Modelo 476 | 55912 Edición Lim,"13,80 EUR",
,,
,,
Figura Funko Pop! Star Wars Rey Modelo 588 | 67614 Edición Especial San Valentín,"14,80 EUR",
"STAR WARS: Star destroyer, accessorio da scrivania illuminato, guerrestellari","70,00 EUR",
CAJA MISTERIOSA STAR WARS - Figuras selladas - De colección - Al azar - ¡Divertido! (Leer descripción),"69,15 EUR",
Star Wars Kylo Ren The Force Awakens Nuovo Sigillato Limited Edition Comic-On,"100,00 EUR",
Bombardero Explorador Hasbro Star Wars Y-Wing con figura Kanan Jarrus,"19,90 EUR",
LEGO Star Wars - Ahsoka Tano - Figur Minifigur Anakin Jedi Interceptor 75401,"16,99 EUR",
Star Wars: Shadows of the Empire juego base completo de cartas coleccionables de Topps 1996,"47,57 EUR",
2024 Topps Star Wars High-Tek - 1x Hobby Box,"146,16 EUR",
STAR WARS THE BLACK SERIES #19 MACE WINDU - Figures (10 cm),"8,00 EUR",
"PERSONALIZADO ANDOR B2EMO SALAVGE DROID para 3.75"" FIGURA DIORAMA (M127)","6,90 EUR",
SPADA LASER LUKE SKYWALKER Luce LED Luce Portachiavi Con Moschettone STAR WARS,"69,20 EUR",
"STAR WARS EPISODE I QUEEN AMIDALA ASCENSION GUN, MOSC (1999) HASBRO, JAPAN, VHTF","29,95 EUR",
Darth Vader Star Wars Black Series Action Figure Actionfigure 1:12,"45,00 EUR",
Soporte de exhibición para LEGO Star Wars 75394 Imperial Star Destroyer,"21,40 EUR",
Action Figure Star Wars - The Black Series Cal Kestis Jedi Fallen Order 15cm New,"41,90 EUR",
Action Figure Star Wars - The Black Series Stormtrooper Jedha Patrol 15 cm New,"41,90 EUR",
LEGO Star Wars Cloud City Boba Fett Minifigura Personalizada 10123 NUEVO,"69,15 EUR",
"Star Wars #15 IG-88, altezza 15cm The Black Series 2011-2015","60,00 EUR",
Star Wars Black Series Super Battle Droid,"32,90 EUR",
Ultra Rare Sideshow STAR WARS CAPTAIN ANTILLES 12” 2165 NEW SEALED,"399,00 EUR",
Star Wars Galactic Files Serie 1 Tarjeta Base #20 Vatios,"2,86 EUR",
STAR WARS X-WING 2.0: - TRICAZA DROIDE- FFG - ESPAÑOL FRANCES PRECINTADO,"24,95 EUR",
Juego de 3 cartas ICONIC YODA + FORCE LIGHTNING 7 cartas Topps Star Wars Card Trader 2025,"5,69 EUR",
STAR WARS Kenner Hasbro Action Figure - POTF - Escape the Death Star Parker EXC,"45,00 EUR",
"STAR WARS RETRO COLLECTION: C-3PO (A NEW HOPE) HASBRO, MOSC - UNPUNCHED","34,95 EUR",
LEGO Star Wars: Placas Impresas - Placas MOC Personalizadas: Impresión en LEGOs Nuevos Auténticos,"7,08 EUR a 13,02 EUR",
Star Wars The Power of the Force Lak Sivrak Kenner 1997,"18,50 EUR",
STAR WARS - Revoltech REVO No.003 C-3PO Episode V Action Figure Kaiyodo,"72,66 EUR",
Figura de acción Chewbacca Hasbro Star Wars Black Series El Retorno del Jedi,"20,00 EUR",
PREORDER Star Wars Deluxe Art Scale Statue 1/10 Luke and Leia 41 cm Iron Studios,"129,00 EUR",
Star Wars Action Figure XT-65 X-Wing Starfighter PVC 10cm Model Toy,"27,82 EUR",
"Action Figure Boba Fett 15cm - Star Wars Black Series, Statua Collezionabile","39,99 EUR",
LEGO® Star Wars™ Minifigura 2 Guardias Pretorianos Imperiales del Set 75386,"11,99 EUR",
Nuevo sellado Star Wars: Tales of the Jedi,"16,29 EUR",
Figure Nite Owl The Mandalorian Star Wars Black Series Hasbro,"33,90 EUR",
Action figure 10cm Star Wars Boba Fett Vintage Collection Kenner Hasbro n° 275,"24,29 EUR",
Figure The Armorer Carbonized The Mandalorian Star Wars Hasbro,"25,90 EUR",
Figura Emperor Royal Guard Black Series Return Of The Jedi Star Wars Hasbro,"34,90 EUR",
STAR WARS - Princess Leia Organa - Figurine Hasbro Black Series 15cm,"34,90 EUR",
Action Figure Star Wars - The Black Series Stormtrooper Jet Trooper 15 cm New,"41,90 EUR",
"STAR WARS RETRO COLLECTION: R2-D2 (A NEW HOPE) HASBRO, MOSC - UNPUNCHED","34,95 EUR",
"Star Wars figure Darth Vader Black Series blue 6"" sealed","46,00 EUR",
LEGO® - Minifiguras - Star Wars - sw1365 - Beach Luke (75389),"13,70 EUR",
"Topps Star Wars Card Trader 2024 HIGH TEK ""You Pick"" ANY Epic Card (s)","3,39 EUR",
Star Wars Mandalorians Bronze Coin 3D Metal Relief Medal in Cover Gift for Fans,"4,58 EUR",
"Obi-Wan Kenobi 50th Archive 6"" Star Wars The Black Series NUEVO D1","25,34 EUR",
Star Wars Retro Collection Chewbacca prototype edition color aleatorio,"12,90 EUR",
Star Wars Guerre Stellari R2D2 R2-D2 Harbert Kenner vintage 1977 action figure,"2.300,00 EUR",
"Hasbro Collectibles - Star Wars: The Acolyte - Colección Retro - 3,75 pulgadas Acti","64,92 EUR",
"Osha Aniseya Fig. 9,5 Cm Star Wars The Acolyte The Vintage Collection","17,95 EUR",
 Star Wars vintage PBP Cloud Car Pilot 2L/Scar no CoO. Pink Face,"150,00 EUR",
Figura R2-d2 Return Of The Jedi Star Wars Black Series Hasbro,"37,00 EUR",
Star Wars Vintage Collection Boba Fett Yellow Card Hasbro,"29,90 EUR",
Star Wars: The Clone Wars The Complete Final Season (Juego de caja de 3 discos) Nuevo,"14,97 EUR",
Figure Zaalbar Star Wars Black Series Gaming Greats Hasbro,"31,00 EUR",
Lego Star Wars Endor Speeder Bike,"5,50 EUR",
Star Wars Black Series Archive Emperor Palpatine Loose / Sin Caja,"14,90 EUR",
"STAR WARS BLACK SERIES: OMEGA (KAMINO) BAD BATCH (6 inch, 15 cm), HASBRO, MISB","11,95 EUR",
LEGO Star Wars Minifigure - Jabba The Hutt (read description),"24,11 EUR",
LEGO DISNEY STAR WARS DARTH MAUL 2022 + MAXIFIGURE JABBA THE HUTT,"27,95 EUR",
,,
,,
Action Figure Star Wars - The Black Series Scarif Stormtrooper 15 cm New Collect,"41,90 EUR",
Star Wars EWOK plush,"48,00 EUR",
Action Figure Star Wars - The Black Series Obi-wan Kenobi Darth Vader 15 cm New,"41,90 EUR",
Figura de acción Bib Fortuna Hasbro Star Wars Serie Negra El Retorno del Jedi,"17,00 EUR",
Star Wars Micro Galaxy Squadron Serie 7 PHANTOM II #0144 Jazwares Nuevo pero SUELTO,"22,92 EUR",
Star Wars Vintage Collection Grand Admiral Thrawn Ahsoka,"18,90 EUR",
Jouet MICRO MACHINES STAR WARS LFL GALOOB PLAYSET NABOO TEMPLERUINE 1998 vintage,"19,90 EUR",
"Lego Minifigure Star Wars - Jar Jar Binks (sw0301) Set 7929, 9499, 75080","9,99 EUR",
ELIGE Imperial Shuttle 1984 Canopy alas rampa de engranajes cañón Star Wars De Colección,"10,95 EUR a 74,93 EUR",
2024 Topps Star Wars Galaxy Chrome 4 Beyond the Cave Yoda,"3,99 EUR",
pistolet laser ~han solo blaster ~star wars -general mills 1978,"140,00 EUR",
The Empire's Back - Premiere Unlimited - Star Wars CCG,"1,00 EUR",
Star Wars Elite Disney figures HASBRO (PLASTIC). Darth Vader. FAC-028050-16261,"33,75 EUR",
Action Figure Star Wars - The Black Series The Mandalorian Boba Fett 15 cm New,"41,90 EUR",
STAR WARS - Luke Skywalker - Figurine Hasbro Black Series 15cm,"34,90 EUR",
Star Wars Darth Vader casco da collezione DeAgostini Lucasfilm,"20,00 EUR",
Star Wars Action Figure Set da 2 PZ - Darth Vader e Stormtrooper - 10 cm - PVC,"21,99 EUR",
1982 Star Wars Empire Strikes Back Colecciones Folleto Inserto - Kenner,"7,61 EUR",
Lego Star Wars Ahsoka Tano sw1354,"9,99 EUR",
LEGO STAR WARS MINIFIGURA `` INQUISITOR MARROK ´´ Ref 75362 NUEVO,"15,95 EUR",
Lego Star Wars 3x Sith sable de luz espada láser,"1,39 EUR",
Star Wars Black Series Ezra Bridger Rebels Hasbro,"29,90 EUR",
Star Wars Power of the Jedi Qui-Gon Jinn 2001,"13,50 EUR",
STAR WARS DROID FACTORY TC-14,"20,00 EUR",
Colección de vehículos fundidos a presión Kenner Star Wars 1978-1980 - tu elección de 11,"28,81 EUR a 40,33 EUR",
1982 Star Wars Empire Strikes Back Colecciones 2 Folletos Insertos - Kenner,"9,52 EUR",
